,Intent,Query,Param
1593,PlayMusic,play steven reineke greatest soundtrack on youtube,steven reineke greatest soundtrack youtube
1594,GetWeather,let me get the forecast in allardt canada,allardt canada
1595,PlayMusic,play fifties music,fifties
1596,GetWeather,will there be a blizzard next friday close in tn,blizzard next friday close tn
1597,GetWeather,what s the weather in stamps,stamps
1598,PlayMusic,play ballad from mandy moore,ballad mandy moore
1599,GetWeather,will it be overcast during meal time in nh,overcast meal nh
1600,PlayMusic,play the track r u professional by roberto carlos braga,track r u professional roberto carlos braga
1601,PlayMusic,play twenties music off of my itunes,twenties itunes
1602,GetWeather,what is the weather forecast tomorrow in french ut,tomorrow french ut
1603,PlayMusic,play bebob on iheart,bebob iheart
1604,GetWeather,what s the weather on groundhog day in slovenia,groundhog day slovenia
1605,PlayMusic,play me a xuefei yang symphony on groove shark,xuefei yang symphony groove shark
1606,PlayMusic,play hanging out and relaxing,hanging out and relaxing
1607,GetWeather,will it be cold in harveysburg wa,cold harveysburg wa
1608,PlayMusic,play me a jill scott sound track on deezer,jill scott sound track deezer
1609,GetWeather,weather for my nearby current location,nearby current location
1610,GetWeather,tell me the weather forecast for mokena,mokena
1611,PlayMusic,play music from 2014,2014
1612,PlayMusic,play some music on netflix,netflix
1613,GetWeather,how cold is it around the current location now,cold around current location now
1614,GetWeather,what s the forecast for my current location,current location
1615,PlayMusic,play slow rock music,slow rock
1616,GetWeather,is it colder in paraguay this morning,colder paraguay morning
1617,GetWeather,i d like the weather forecast in gang mills four years from now,gang mills four years from now
1618,GetWeather,what is the forecast in kearneysville,kearneysville
1619,PlayMusic,use vimeo to play a mark king record from 1993,vimeo mark king record 1993
1620,GetWeather,what is the weather going to be like in twenty three minutes in parksdale in,twenty three minutes parksdale in
1621,PlayMusic,i d like to listen to iheart radio s chill out playlist please,iheart chill out
1622,PlayMusic,play ep from quasimoto from the nineties,ep quasimoto nineties
1623,PlayMusic,play an asha bhosle song from around 1964,asha bhosle song 1964
1624,GetWeather,will it snowstorm in lampi island marine national park,snowstorm lampi island marine national park
1625,PlayMusic,play that stubborn kinda fellow by michael amott,that stubborn kinda fellow michael amott
1626,GetWeather,check the forecast for keene,keene
1627,PlayMusic,play got to be free by madeleine peyroux,got to be free madeleine peyroux
1628,PlayMusic,play 2004 on pandora,2004 pandora
1629,GetWeather,is cape mount nature conservation unit has storm weather,cape mount nature conservation unit storm
1630,PlayMusic,play roy orbison tunes now,roy orbison
1631,GetWeather,what s the weather forecast for oman 2 months from now,oman 2 months from now
1632,PlayMusic,play jazz music by zvooq,jazz zvooq
1633,GetWeather,will it be hotter in my current place in six weeks from now,hotter current place six weeks from now
1634,PlayMusic,play me the last 1980 record by brenda kahn,last 1980 record brenda kahn
1635,GetWeather,tell me the weather forecast for northern mariana islands one second from now,northern mariana islands one second from now
1636,PlayMusic,play a track by yui on vimeo,track yui vimeo
1637,GetWeather,tell me if it ll be colder next november in granite-steppe lands of buh,colder next november granite-steppe lands of buh
1638,GetWeather,show weather forecast in as,as
1639,PlayMusic,play a top symphony from the fourties,top symphony fourties
1640,GetWeather,will it get chilly 1 minute from now in carterville,chilly 1 minute from now carterville
1641,PlayMusic,play music off netflix,netflix
1642,GetWeather,when it comes to dukes and the district of columbia what will the weather be in one hour,dukes district of columbia in one hour
1643,PlayMusic,play the gary chaw album,gary chaw album
1644,GetWeather,she me the forecast for clayton lake state park on oct 17th,clayton lake state park oct 17th
1645,PlayMusic,play sense tu from ebi hamedi,sense tu ebi hamedi
1646,PlayMusic,play zvooq southern gothic,zvooq southern gothic
1647,GetWeather,what is the forecast in mer rouge and palestine,mer rouge palestine
1648,GetWeather,what s the weather forecast for next saturday in granite wi,next saturday granite wi
1649,PlayMusic,play a 2007 track from adam jones,2007 track adam jones
1650,GetWeather,is it going to be hot on oct the 8th 2020 in the neighboring greenland area,hot oct the 8th 2020 neighboring greenland area
1651,PlayMusic,play the most popular 1956 record,most popular 1956 record
1652,GetWeather,is it going to be humid faraway from here around dinner time,humid faraway here around dinner
1653,GetWeather,will it be overcast at lunch time in saint vincent and the grenadines,overcast lunch saint vincent and the grenadines
1654,PlayMusic,play a ballad by giorgio moroder,ballad giorgio moroder
1655,PlayMusic,play music by cass elliot,cass elliot
1656,PlayMusic,play some sister rosetta tharpe songs from the eighties,sister rosetta tharpe eighties
1657,GetWeather,what is the weather forecast in country club heights,country club heights
1658,PlayMusic,play a popular chant by brian epstein,popular chant brian epstein
1659,GetWeather,will there be a storm in palm city wv,storm palm city wv
1660,GetWeather,is it going to rain at my current position,rain current position
1661,GetWeather,what will the weather be at my current location on december the 2nd 2029,current location december the 2nd 2029
1662,PlayMusic,play some music on vimeo,vimeo
1663,PlayMusic,play marche lorraine by rachael lampa,marche lorraine rachael lampa
1664,GetWeather,tell me when there will be a snowstorm in clifton forge,snowstorm clifton forge
1665,GetWeather,what will the humidity be in beroun on aug 26,humidity beroun aug 26
1666,GetWeather,is it snowy in audra state park or within the same area,snowy audra state park within the same area
1667,PlayMusic,play the last song by goldie,last song goldie
1668,PlayMusic,let me listen to the music of nature album by paul draper,the music of nature album paul draper
1669,PlayMusic,play some armik from the fourties,armik fourties
1670,PlayMusic,play the best 1981 sound track from ric fierabracci,best 1981 sound track ric fierabracci
1671,GetWeather,what is the weather forecast in pinson south dakota,pinson south dakota
1672,GetWeather,what s the weather forecast for my current position,current position
1673,PlayMusic,play some chant music by kevin jonas on deezer,chant kevin jonas deezer
1674,GetWeather,what is the weather like now in ak,now ak
1675,PlayMusic,play a chant from the fifties,chant fifties
1676,PlayMusic,play marche lorraine by rachael lampa,marche lorraine rachael lampa
1677,GetWeather,what will the weather be like at two o clock in el salvador,two o clock el salvador
1678,PlayMusic,play some music from the thirties,thirties
1679,GetWeather,will it get colder in cape fair,colder cape fair
1680,GetWeather,what s the weather in springside nature reserve at four pm,springside nature reserve four pm
1681,PlayMusic,i want to hear the newest music from the railway children,newest the railway children
1682,PlayMusic,play the most popular miles jones track,most popular miles jones track
1683,PlayMusic,play some house music,house
1684,PlayMusic,play some music from 1995,1995
1685,PlayMusic,play the top-20 music by merz,top-20 merz
1686,GetWeather,what is the forecast for temperate weather in bellechester,temperate bellechester
1687,PlayMusic,play a symphonic rock on pandora,symphonic rock pandora
1688,GetWeather,what will the weather be nineteen seconds from now from the little manatee river state park,nineteen seconds from now little manatee river state park
1689,PlayMusic,play socialism is good by terje bakken on spotify,socialism is good terje bakken spotify
1690,GetWeather,what is the weather in åland 4 seconds from now,åland 4 seconds from now
1691,PlayMusic,play newest robert palmer sound track,newest robert palmer sound track
1692,GetWeather,do you know if it will be chilly today in puerto rico,chilly today puerto rico
1693,GetWeather,what is the twenty one o clock forecast for the current spot,twenty one o clock current spot
1694,GetWeather,is it hot in zephyrhills,hot zephyrhills
1695,PlayMusic,play some krzysztof penderecki on last fm,krzysztof penderecki last fm
1696,GetWeather,tell me the weather forecast for my current place at 15 o clock,current place 15 o clock
1697,PlayMusic,play my hype playlist on youtube,hype youtube
1698,PlayMusic,play any chant from 1973,chant 1973
1699,PlayMusic,can you play something from the fourties preferably a symphony,fourties symphony
1700,GetWeather,let me know how the weather will be in rainelle at night,rainelle night
1701,GetWeather,what is the forecast for this current position for chilly temps,current position chilly
1702,PlayMusic,play me a song by stephen jones,song stephen jones
1703,GetWeather,will it get cloudy in cliffwood beach,cloudy cliffwood beach
1704,PlayMusic,play the latest songs by larry gatlin on iheart,latest larry gatlin iheart
1705,PlayMusic,play some theme songs from the fourties,theme fourties
1706,PlayMusic,play the wizard and i on zvooq,the wizard and i zvooq
1707,PlayMusic,play the best music by arthur johnston,best arthur johnston
1708,PlayMusic,play a sixties song by george sanger,sixties song george sanger
1709,PlayMusic,open zvooq and play the best songs from device,zvooq best device
1710,GetWeather,is it going to be foggy at two am in barberville,foggy two am barberville
1711,GetWeather,tell me the forecast for rogers city ms,rogers city ms
1712,PlayMusic,play addicted to you by hank ballard,addicted to you hank ballard
1713,PlayMusic,play my trabajo relax playlist,trabajo relax
1714,PlayMusic,play top rosanne cash,top rosanne cash
1715,PlayMusic,play something off my new boots playlist,new boots
1716,GetWeather,tell me the forecast for sweden,sweden
1717,PlayMusic,can you play some synthpop music on youtube,synthpop youtube
1718,PlayMusic,i want to hear jimmy james from the thirties play a song on groove shark,jimmy james thirties song groove shark
1719,PlayMusic,play safe rock and roll sucks on lastfm,safe rock and roll sucks lastfm
1720,GetWeather,will it be colder 1 minute from now in jersey,colder 1 minute from now jersey
1721,GetWeather,is it going to be freezing in mahwah missouri on december the fifth 2025,freezing mahwah missouri december the fifth 2025
1722,GetWeather,what is the forecast for de on 9/11/2035,de 9/11/2035
1723,GetWeather,what will the weather be in one minute in tanzania,in one minute tanzania
1724,GetWeather,what is the weather forecast for boden,boden
1725,PlayMusic,use itunes to play music,itunes
1726,PlayMusic,play 1958 music,1958
1727,GetWeather,show the forecast for moonlight beach at 10/4/2021,moonlight beach 10/4/2021
1728,PlayMusic,i want to hear a sandra ep,sandra ep
1729,GetWeather,what s the weather going to be like in a week at big walnut creek nature preserve,week big walnut creek nature preserve
1730,PlayMusic,play me a song by avispa music from 1965,song avispa music 1965
1731,GetWeather,how much hotter will it be once close to namibia,hotter close namibia
1732,PlayMusic,play a jack lawrence concerto,jack lawrence concerto
1733,GetWeather,will it be colder in oswego 16 weeks from now,colder oswego 16 weeks from now
1734,PlayMusic,play music from paul landers,paul landers
1735,GetWeather,is it going to be freezing at tea time in michigantown ks,freezing tea michigantown ks
1736,PlayMusic,play a track by alpha blondy with deezer,track alpha blondy deezer
1737,GetWeather,check the weather forecast for sappho,sappho
1738,GetWeather,will it be warmer at sunrise in jeffrey city,warmer sunrise jeffrey city
1739,GetWeather,hows the weather looking for kendall green maryland,kendall green maryland
1740,PlayMusic,play a song from 2003,song 2003
1741,GetWeather,what is the weather in nd the city of evangeline,nd evangeline
1742,GetWeather,in ut at 7 pm will it be snowy,ut 7 pm snowy
1743,PlayMusic,play on spotify ms scandalous,spotify ms scandalous
1744,GetWeather,will there be snowfall this month in ut,snowfall this month ut
1745,GetWeather,tell me the weather forecast for carmichaels gambia at one am,carmichaels gambia one am
1746,GetWeather,tell me if it will be hot on jun the 10th in san de fuca sweden,hot jun the 10th san de fuca sweden
1747,GetWeather,is there rain in afghanistan,rain afghanistan
1748,PlayMusic,play music by artist mark ashley,mark ashley
1749,PlayMusic,play a seventies soundtrack by steve walsh on groove shark,seventies soundtrack steve walsh groove shark
1750,PlayMusic,play soheila zaland,soheila zaland
1751,GetWeather,what s the weather going to be like not far from east timor,not far east timor
1752,GetWeather,weather for burr,burr
1753,GetWeather,what is the forecast at four am in zambia,four am zambia
1754,GetWeather,what is the weather forecast for midnight in dc,midnight dc
1755,GetWeather,will the weather be warm in the nationaal park band-e amir at twelve am,warm nationaal park band-e amir twelve am
1756,PlayMusic,play some drum & bass,drum & bass
1757,PlayMusic,play music from the track she came in through the bathroom window,track she came in through the bathroom window
1758,PlayMusic,play new music from liang wern fook,new liang wern fook
1759,PlayMusic,play greatest chant music from beni arashiro,greatest chant beni arashiro
1760,GetWeather,will there be snowfall this month in ut,snowfall this month ut
1761,PlayMusic,can you play the newest record from 1966 by tony lee,newest record 1966 tony lee
1762,GetWeather,will it get warmer in czechia,warmer czechia
1763,GetWeather,what s the weather forecast for 3 hours from now at christmas island,3 hours from now christmas island
1764,PlayMusic,play a popular sound track by joe pass on itunes,popular sound track joe pass itunes
1765,PlayMusic,play the top 1991 sound track,top 1991 sound track
1766,PlayMusic,please play some fourties music on spotify,fourties spotify
1767,PlayMusic,play industrial music,industrial
1768,GetWeather,will it hail in 1 minute in toms river,hail in 1 minute toms river
1769,GetWeather,show me weather forecast in clontarf ky from 4 hours from now,clontarf ky 4 hours from now
1770,GetWeather,what does it feel like in alloway,alloway
1771,GetWeather,what will the weather be in peru,peru
1772,GetWeather,is it hot in round hill hi,hot round hill hi
1773,PlayMusic,play a song by alasdair roberts from 1996,song alasdair roberts 1996
1774,GetWeather,what is the weather like in the city of frewen in the country of venezuela,frewen venezuela
1775,PlayMusic,play a seventies ballad by annunzio paolo mantovani on groove shark,seventies ballad annunzio paolo mantovani groove shark
1776,PlayMusic,open vimeo and paly every song released in 1986,vimeo every song 1986
1777,GetWeather,will a blizzard hit torrey pines state natural reserve on jun sixteenth,blizzard torrey pines state natural reserve jun sixteenth
1778,GetWeather,what is the weather forecast for friona,friona
1779,GetWeather,is it hot in gold beach bahrain,hot gold beach bahrain
1780,PlayMusic,will you play me the most popular sound track from 2006,most popular sound track 2006
1781,GetWeather,what s the weather like in kaltag,kaltag
1782,GetWeather,is it hot in bolivia,hot bolivia
1783,PlayMusic,i want to hear the live at slane castle album by haifa wehbe,live at slane castle album haifa wehbe
1784,PlayMusic,listen to ballad songs from 1999,ballad 1999
1785,GetWeather,what s the weather in mayotte,mayotte
1786,GetWeather,tell me the weather forecast for september 21 2030 in palau,september 21 2030 palau
1787,GetWeather,how temperate will it be here this week,temperate here this week
1788,GetWeather,will it get foggy in spring hill,foggy spring hill
1789,GetWeather,weather within the same area as qatar at four,within the same area qatar four
1790,PlayMusic,play some sixties on netflix,sixties netflix
1791,PlayMusic,play me a fifties song by chingy,fifties song chingy
1792,PlayMusic,play any song from 2006,song 2006
1793,PlayMusic,please play kabhi jo baadal barse by ruth lorenzo,kabhi jo baadal barse ruth lorenzo
1794,PlayMusic,play music from alison sudol,alison sudol
1795,PlayMusic,play some nineties eliza carthy,nineties eliza carthy
1796,PlayMusic,can you play crossover,crossover
1797,PlayMusic,please play a song by everlast,song everlast
1798,GetWeather,how much hotter will it be here tomorrow,hotter here tomorrow
1799,PlayMusic,play some thirties music on netflix,thirties netflix
1800,PlayMusic,open the canciones del recuerdo playlist and play songs,canciones del recuerdo
1801,GetWeather,what is the forecast for close to texas,close texas
1802,PlayMusic,play midnight special,midnight special
1803,PlayMusic,play fourties chant music on last fm,fourties chant last fm
1804,PlayMusic,play music from 1969 on lastfm,1969 lastfm
1805,PlayMusic,play some chant music by kevin jonas on deezer,chant kevin jonas deezer
1806,GetWeather,how much wind will there be in nm on november 11th,wind nm november 11th
1807,GetWeather,whats the weather forecast in nicaragua,nicaragua
1808,PlayMusic,play music from 2012 on google music,2012 google music
1809,GetWeather,will it be warm at tembe elephant park on san jacinto day,warm tembe elephant park san jacinto day
1810,PlayMusic,can you play the newest record from 1966 by tony lee,newest record 1966 tony lee
1811,GetWeather,is it cold in brian head,cold brian head
1812,PlayMusic,play some katiejane garside on vimeo,katiejane garside vimeo
1813,PlayMusic,use groove shark to play the today and tomorrow album,groove shark today and tomorrow album
1814,GetWeather,what is the weather forecast for minnesota,minnesota
1815,GetWeather,what is the baotianman national nature reserve forecast,baotianman national nature reserve
1816,GetWeather,is it overcast close-by in illinois,overcast close-by illinois
1817,PlayMusic,play some music from 1962 from adeyto,1962 adeyto
1818,PlayMusic,play the top song by jack grisham,top song jack grisham
1819,GetWeather,tell me the weather forecast for northern mariana islands one second from now,northern mariana islands one second from now
1820,GetWeather,will there be a snowstorm in slick or four hours from now,snowstorm slick or four hours from now
1821,PlayMusic,play something by brian chase,brian chase
1822,GetWeather,will it be colder at midnight in washington,colder midnight washington
1823,PlayMusic,play some twenties chant music on slacker,twenties chant slacker
1824,PlayMusic,play lukasz gottwald album on zvooq,lukasz gottwald album zvooq
1825,GetWeather,in wynnedale ak will it blizzard,wynnedale ak blizzard
1826,GetWeather,what is the weather forecast for djibouti,djibouti
1827,PlayMusic,use deezer to play music by kimberley walsh,deezer kimberley walsh
1828,PlayMusic,play crossroad blues,crossroad blues
1829,PlayMusic,play the best songs of 2016,best 2016
1830,PlayMusic,i want to listen to merrily we roll along by marko desantis,merrily we roll along marko desantis
1831,GetWeather,what is the weather like in phnom sankos wildlife sanctuary,phnom sankos wildlife sanctuary
1832,PlayMusic,play music by helen ward,helen ward
1833,PlayMusic,play music on iheart,iheart
1834,GetWeather,is it forecast to be stormy close to nimule-nationalpark 1 hour from now,stormy close nimule-nationalpark 1 hour from now
1835,GetWeather,what s the weather forecast for walsenburg vermont for july 13th,walsenburg vermont july 13th
1836,GetWeather,will it be foggy now close to jolley,foggy now close jolley
1837,GetWeather,what is the forecast this evening for the calipuy national reservation,evening calipuy national reservation
1838,GetWeather,is it cold in north carolina,cold north carolina
1839,GetWeather,forecast for wisconsin at 10 pm,wisconsin 10 pm
1840,GetWeather,what is it like on 7/10/2023 in the current place,7/10/2023 current place
1841,PlayMusic,open lastfm and play a voluntad del cielo from wax,lastfm a voluntad del cielo wax
1842,PlayMusic,i want to hear a good album from toni cottura,good album toni cottura
1843,GetWeather,is it cold in the current location more than it was in 3 years,cold current location in 3 years
1844,GetWeather,give me a weather forecast for ca,ca
1845,PlayMusic,play bald by kaskade,bald kaskade
1846,PlayMusic,play ciribiribin by sandeep khare,ciribiribin sandeep khare
1847,PlayMusic,play chance of a lifetime on zvooq,chance of a lifetime zvooq
1848,PlayMusic,can you play some andrew cash music on slacker,andrew cash slacker
1849,PlayMusic,play soem nineties charles thompson,nineties charles thompson
1850,GetWeather,will there be hail in kaffir,hail kaffir
1851,GetWeather,what are the weather conditions going to be like in manhasset vermont on dec the 6th 2036,manhasset vermont dec the 6th 2036
1852,PlayMusic,play in your eyes by gareth gates on netflix,in your eyes gareth gates netflix
1853,GetWeather,is there rain in nauru at 6 am,rain nauru 6 am
1854,PlayMusic,play songs by cheryl wheeler,cheryl wheeler
1855,GetWeather,what will the weather be like in the falkland islands starting may 25 2022,falkland islands may 25 2022
1856,PlayMusic,play breed the killers on itunes,breed the killers itunes
1857,PlayMusic,play 1988 chant music on itunes,1988 chant itunes
1858,GetWeather,is it going to be cold today in wing,cold today wing
1859,PlayMusic,play the newest phil stacey,newest phil stacey
1860,PlayMusic,play a 1964 symphony on netflix,1964 symphony netflix
1861,PlayMusic,open netflix and play kan man gifta sig i jeans,netflix kan man gifta sig i jeans
1862,GetWeather,what s the weather like in big delta,big delta
1863,PlayMusic,use service vimeo the genre slow rock,vimeo slow rock
1864,GetWeather,tell me when it ll be chillier in cavalero corner id,chillier cavalero corner id
1865,GetWeather,what s the weather for april 10th 2028 in arkansas,april 10th 2028 arkansas
1866,PlayMusic,play music on netflix by don kikas,netflix don kikas
1867,GetWeather,how cold is it in cargray argentina,cold cargray argentina
1868,PlayMusic,play some dream music,dream
1869,PlayMusic,play elliot easton s album beautiful,elliot easton album beautiful
1870,PlayMusic,play some eddie vinson on deezer,eddie vinson deezer
1871,PlayMusic,play the best sort by jan robbe on pandora,best jan robbe pandora
1872,PlayMusic,play easy listening,easy listening
1873,PlayMusic,play songs by wise,wise
1874,PlayMusic,play tom baxter tracks,tom baxter
1875,PlayMusic,play me a 2015 soundtrack on netflix,2015 soundtrack netflix
1876,PlayMusic,play music from 1958,1958
1877,GetWeather,which day this week will it get chilly in palmetto in,day week chilly palmetto in
1878,GetWeather,is it chilly in fm,chilly fm
1879,GetWeather,what will the weather be like 56 weeks from now will there be sun in tabor,56 weeks from now sun tabor
1880,PlayMusic,play eighties track,eighties track
1881,PlayMusic,play music by paul mccartney,paul mccartney
1882,PlayMusic,play saturday nights & sunday mornings,saturday nights & sunday mornings
1883,GetWeather,tell me the weather forecast for june seventeenth 2034 in fl,june seventeenth 2034 fl
1884,PlayMusic,play an masaki aiba tune,masaki aiba tune
1885,PlayMusic,play the track the wizard and i,track the wizard and i
1886,PlayMusic,play fourties soundtrack from hamish maccunn,fourties soundtrack hamish maccunn
1887,GetWeather,is there a blizzard coming to el verano,blizzard el verano
1888,PlayMusic,play some tango,tango
1889,GetWeather,is it warm in sierra blanca now,warm sierra blanca now
1890,PlayMusic,can you play a top song from a chyi chin concerto,top song chyi chin concerto
1891,GetWeather,how s the weather in brookdale zimbabwe,brookdale zimbabwe
1892,PlayMusic,play the fool on the hill by khwaja ghulam farid,the fool on the hill khwaja ghulam farid
1893,PlayMusic,play a scott lafaro soundtrack,scott lafaro soundtrack
1894,GetWeather,will it be stormy not far from id on 10/2/2021,stormy not far id 10/2/2021
1895,GetWeather,is snowfall forecast in pa,snowfall pa
1896,PlayMusic,play chant music by big dee irwin,chant big dee irwin
1897,GetWeather,what s the weather going to be one hour from now in taiwan,one hour from now taiwan
1898,GetWeather,will the weather conditions be temperate and pleasant in togo,temperate pleasant togo
1899,PlayMusic,play the music of filipp bedrossowitsch kirkorow s theme,filipp bedrossowitsch kirkorow theme
1900,PlayMusic,play the album making evening and night by cevin key,album making evening and night cevin key
1901,PlayMusic,play something from my songs for you not your parents playlist,songs for you not your parents
1902,PlayMusic,play me a song from voices & images,song voices & images
1903,PlayMusic,play a popular ballad by amanda,popular ballad amanda
1904,GetWeather,will it be hot in dongola cameroon,hot dongola cameroon
1905,PlayMusic,play music by young steff,young steff
1906,GetWeather,what will the weather be in allenwood,allenwood
1907,GetWeather,is it supposed to snow in nv,snow nv
1908,PlayMusic,play top 20 from frank farian,top 20 frank farian
1909,PlayMusic,play music on groove shark,groove shark
1910,GetWeather,give me the weather forecast for here,here
1911,GetWeather,what will the weather be like here next week,here next week
1912,GetWeather,will it be chillier on october 17 nearby east glacier park,chillier october 17 nearby east glacier park
1913,PlayMusic,i want to hear papa mali s songs from the fifties,papa mali fifties
1914,PlayMusic,play a sixties song by george sanger,sixties song george sanger
