,Intent,Query,Param
3181,GetWeather,tell me the weather forecast for my current place at 15 o clock,current place 15 o clock
3182,GetWeather,check the weather forecast for sappho,sappho
3183,GetWeather,what is the 7 day for cheat canyon wildlife management area,7 day cheat canyon wildlife management area
3184,GetWeather,will there be snowfall in zero pm in estonia,snowfall zero pm estonia
3185,PlayMusic,play a theme from 1985 by patrick cowley,theme 1985 patrick cowley
3186,GetWeather,what will it be like in six pm at the current place,six pm current place
3187,PlayMusic,i want to hear jimmy james from the thirties play a song on groove shark,jimmy james thirties song groove shark
3188,GetWeather,is it hotter here on navy birthday,hotter here navy birthday
3189,PlayMusic,can you play some music on youtube,youtube
3190,GetWeather,what is the weather forecast for moffett,moffett
3191,GetWeather,what is the weather for charlotte hall saint kitts and nevis,charlotte hall saint kitts and nevis
3192,PlayMusic,play the música da série de filmes o hobbit album by alex otaola,música da série de filmes o hobbit album alex otaola
3193,PlayMusic,play dansevise by ebi on groove shark,dansevise ebi groove shark
3194,GetWeather,what will the weather forecast be in mount victory delaware in 1 second,mount victory delaware in 1 second
3195,GetWeather,will there be a lot of sun in dry prong somalia at 5 pm,sun dry prong somalia 5 pm
3196,GetWeather,what will the weather be like in 1 hour in bethesda,in 1 hour bethesda
3197,GetWeather,weather in radnor township wv,radnor township wv
3198,GetWeather,is it snowy in demotte ms,snowy demotte ms
3199,PlayMusic,play my still got the blues playlist,still got the blues
3200,PlayMusic,play a top twenty sort by akinyele,top twenty akinyele
3201,GetWeather,tell me when it ll be sunny in ralls marshall islands,sunny ralls marshall islands
3202,PlayMusic,please play good music by will oldham,good will oldham
3203,PlayMusic,play the top hits of 2016,top 2016
3204,GetWeather,is it chillier here,chillier here
3205,PlayMusic,play piano ballads on netflix,piano ballads netflix
3206,PlayMusic,i want to hear music on my slacker app,slacker
3207,GetWeather,is it supposed to hail in ny,hail ny
3208,PlayMusic,please play kabhi jo baadal barse by ruth lorenzo,kabhi jo baadal barse ruth lorenzo
3209,GetWeather,will it be hotter in conception junction moldova,hotter conception junction moldova
3210,PlayMusic,play any chanson,chanson
3211,GetWeather,is saint robert hotter than turkmenistan,saint robert hotter turkmenistan
3212,PlayMusic,play some noise music on netflix,noise netflix
3213,GetWeather,tell me when it will be warmer in woods hole oklahoma,warmer woods hole oklahoma
3214,PlayMusic,play a popular sort of fifties tune music,popular fifties tune
3215,PlayMusic,open vimeo and paly every song released in 1986,vimeo every song 1986
3216,GetWeather,how will snowfall be here in 2/21/2022,snowfall here 2/21/2022
3217,PlayMusic,please play a song from the thirties by peter murphy on last fm,song thirties peter murphy last fm
3218,PlayMusic,play music from the artist taktloss from the record in the thirties,taktloss record thirties
3219,GetWeather,will it be stormy in charleston,stormy charleston
3220,GetWeather,whats the forecast for january 21 2035 in dubach,january 21 2035 dubach
3221,GetWeather,is it foggy in phinizy swamp nature park,foggy phinizy swamp nature park
3222,PlayMusic,play music by otis redding,otis redding
3223,GetWeather,can you get the weather forecast for new baden,new baden
3224,GetWeather,is it cloudy in vermont on 06:30:26 pm,cloudy vermont 06:30:26 pm
3225,PlayMusic,play going down to the river on pandora,going down to the river pandora
3226,GetWeather,what s the forecast for ks for jan first,ks jan first
3227,PlayMusic,play 1988 chant music on itunes,1988 chant itunes
3228,PlayMusic,play some the lady is a tramp from timour moutsouraev,the lady is a tramp timour moutsouraev
3229,PlayMusic,play my fusion fest playlist on youtube,fusion fest youtube
3230,GetWeather,what will the weather be like in 1 minute in my current position,in 1 minute current position
3231,PlayMusic,play some dave pearce,dave pearce
3232,GetWeather,weather for 9/3/2034 at bridle trails state park,9/3/2034 bridle trails state park
3233,GetWeather,what s the weather going to be like here in one minute,here in one minute
3234,PlayMusic,play a record from 2005 by ruslana lyschytschko,record 2005 ruslana lyschytschko
3235,GetWeather,will it be colder at midnight in washington,colder midnight washington
3236,PlayMusic,i want to listen to a concerto from timour moutsouraev,concerto timour moutsouraev
3237,PlayMusic,play asia nitollano using itunes,asia nitollano itunes
3238,PlayMusic,play the fool on the hill by khwaja ghulam farid,the fool on the hill khwaja ghulam farid
3239,GetWeather,is it going to be rainy here one second from now,rainy here one second from now
3240,PlayMusic,would you please play me a symphony from 1995,symphony 1995
3241,PlayMusic,play monie love tunes on google music from 1984 from her song list,monie love google music 1984 song
3242,GetWeather,tell me the predicted weather once i travel faraway to crimson lake provincial park,faraway crimson lake provincial park
3243,PlayMusic,play something from the twenties,twenties
3244,PlayMusic,play some gangsta music,gangsta
3245,PlayMusic,please play me something by new wave of american heavy metal,new wave of american heavy metal
3246,GetWeather,will there be a lot of sun in dry prong somalia at 5 pm,sun dry prong somalia 5 pm
3247,PlayMusic,i want to hear some boris grebenchtchikov on zvooq,boris grebenchtchikov zvooq
3248,PlayMusic,play some acapella music,acapella
3249,GetWeather,is there snowfall in hineston new hampshire,snowfall hineston new hampshire
3250,PlayMusic,play something from the twenties,twenties
3251,PlayMusic,play my hardstyle baby playlist on netflix,hardstyle baby netflix
3252,GetWeather,can you give me the forecast for 10:15 in paraguay,10:15 paraguay
3253,GetWeather,will there be wind in loyola,wind loyola
3254,PlayMusic,play me some folklore music,folklore
3255,PlayMusic,play my women of rock playlist,women of rock
3256,GetWeather,will it storm in north sioux city al,storm north sioux city al
3257,PlayMusic,can you play a melody from the fifties on last fm,melody fifties last fm
3258,PlayMusic,play grabsteinland i by doctor fink on slacker radio,grabsteinland i doctor fink slacker
3259,PlayMusic,play some mark tremonti from the thirties,mark tremonti thirties
3260,GetWeather,what is the forecast for 15:04 in georgia for overcast conditions in valley view,15:04 georgia overcast valley view
3261,PlayMusic,play a twenties tune by jodie aysha,twenties tune jodie aysha
3262,GetWeather,what is the forecast this month in kosovo,this month kosovo
3263,GetWeather,i want to book a restaurant in neshanic station nigeria for 06:18:13 pm,neshanic station nigeria 06:18:13 pm
3264,GetWeather,what is the forecast for warm weather in carl,warm carl
3265,PlayMusic,play some tony grant,tony grant
3266,PlayMusic,play some movement by dj spinna,movement dj spinna
3267,GetWeather,is there rain in nauru at 6 am,rain nauru 6 am
3268,PlayMusic,play neutrons by seun kuti,neutrons seun kuti
3269,GetWeather,what will the humidity be in beroun on aug 26,humidity beroun aug 26
3270,GetWeather,what is the weather forecast for piqua on pearl harbor remembrance day,piqua pearl harbor remembrance day
3271,GetWeather,how is the weather going to be in pearblossom,pearblossom
3272,GetWeather,tell me if there will be a depression today in kiribati,depression today kiribati
3273,GetWeather,what s the weather forecast for here on jul 23,here jul 23
3274,GetWeather,is it forecast to be chillier in latvia,chillier latvia
3275,PlayMusic,can you pull up and play something on itunes,itunes
3276,PlayMusic,play ballad from mandy moore,ballad mandy moore
3277,PlayMusic,play the sound track by ferry corsten,sound track ferry corsten
3278,PlayMusic,play trace adkins music from the thirties,trace adkins thirties
3279,PlayMusic,play some tango on iheart,tango iheart
3280,PlayMusic,play me a bluegrass song,bluegrass song
3281,GetWeather,will the weather be warm in the nationaal park band-e amir at twelve am,warm nationaal park band-e amir twelve am
3282,PlayMusic,play me a song from 1968 on spotify,song 1968 spotify
3283,GetWeather,what is the jan 8 forecast for here,jan 8 here
3284,GetWeather,what is the forecast for the current spot for cloudy conditions,current spot cloudy
3285,GetWeather,will it be colder in tallgrass prairie national preserve,colder tallgrass prairie national preserve
3286,PlayMusic,i want to hear a good album from toni cottura,good album toni cottura
3287,GetWeather,is there a storm here,storm here
3288,GetWeather,how s the weather going to be at fourteen o clock in falkland islands,fourteen o clock falkland islands
3289,PlayMusic,play salmonella dub dvd by mario rubalcaba on vimeo,salmonella dub dvd mario rubalcaba vimeo
3290,GetWeather,will it be cold here in one hour,cold here in one hour
3291,GetWeather,what is the forecast for orienta for hotter weather,orienta hotter
3292,GetWeather,what s the weather forecast for central north dakota,central north dakota
3293,PlayMusic,play some 1970 antero manninen on zvooq,1970 antero manninen zvooq
3294,PlayMusic,play fourties tunes by bryan webb on groove shark,fourties bryan webb groove shark
3295,GetWeather,on may the thirteenth 2037 what will it be like in wilderville montenegro,may the thirteenth 2037 wilderville montenegro
3296,PlayMusic,play music in the genre soundtrack,soundtrack
3297,PlayMusic,play shara worden,shara worden
3298,GetWeather,will it be snowy here soon,snowy here
3299,PlayMusic,play a theme from 1985 by patrick cowley,theme 1985 patrick cowley
3300,PlayMusic,play a new song form the eighties,new song eighties
3301,GetWeather,is it warm in fernley,warm fernley
3302,PlayMusic,play lastfm tunes from 1997,lastfm 1997
3303,GetWeather,what are the weather conditions in patagonia south africa,patagonia south africa
3304,GetWeather,weather for jan 7 in north carolina,jan 7 north carolina
3305,PlayMusic,use service vimeo the genre slow rock,vimeo slow rock
3306,GetWeather,is it going to be nice in sandoval belgium,sandoval belgium
3307,PlayMusic,play deezer,deezer
3308,PlayMusic,play peja tunes,peja
3309,GetWeather,what s the weather this month in mozambique,this month mozambique
3310,GetWeather,what s the weather next week in somis,next week somis
3311,PlayMusic,play furusato on google music,furusato google music
3312,GetWeather,what is the forecast for harrison–crawford state forest,harrison–crawford state forest
3313,GetWeather,tell me if there will be a snowstorm on sep the second 2028 in olpe,snowstorm sep the second 2028 olpe
3314,PlayMusic,i d like to listen to opera on youtube,opera youtube
3315,GetWeather,what is the weather forecast for tennessee for warm temps,tennessee warm
3316,PlayMusic,play music by cass elliot,cass elliot
3317,PlayMusic,i want to hear something from the top-fifty by jose pasillas,top-fifty jose pasillas
3318,PlayMusic,play the song long live love,song long live love
3319,GetWeather,what is the forecast for here and now,here now
3320,GetWeather,what is the weather forecast for winger,winger
3321,PlayMusic,play music from 2007,2007
3322,GetWeather,weather in tioga colorado,tioga colorado
3323,GetWeather,what s the weather like in wyandotte netherlands antilles,wyandotte netherlands antilles
3324,PlayMusic,play instrumental pop,instrumental pop
3325,GetWeather,is it going to be temperate in farallon islands now,temperate farallon islands now
3326,PlayMusic,play me a song from luxury liner,song luxury liner
3327,PlayMusic,play alles heeft ritme by liu tianhua,alles heeft ritme liu tianhua
3328,PlayMusic,i want to listen to my spain top 50 playlist on groove shark,spain top 50 groove shark
3329,GetWeather,what will the weather be in bernie id,bernie id
3330,PlayMusic,open last fm and play the top song from daniel lee chee hun,last fm top song daniel lee chee hun
3331,PlayMusic,play odessa by maartin allcock,odessa maartin allcock
3332,PlayMusic,play a 1994 tune by lena horne,1994 tune lena horne
3333,GetWeather,is it chillier in mint hill fm,chillier mint hill fm
3334,PlayMusic,play some deezer oldies music,deezer oldies
3335,PlayMusic,play theme by yanni on vimeo,theme yanni vimeo
3336,GetWeather,is the expected weather temperate here in 1 month,temperate here in 1 month
3337,PlayMusic,play some prabha atre,prabha atre
3338,PlayMusic,play the mister music man by gene de paul,mister music man gene de paul
3339,GetWeather,what is the weather forecast for ridge farm new york,ridge farm new york
3340,PlayMusic,play itunes album mondovisione,itunes album mondovisione
3341,PlayMusic,play divine from vinnie roslin,divine vinnie roslin
3342,GetWeather,tell me if it will hail in kyrgyzstan,hail kyrgyzstan
3343,PlayMusic,play the album wayning moments by rabbit brown,album wayning moments rabbit brown
3344,GetWeather,will there be a blizzard in oregon,blizzard oregon
3345,PlayMusic,play my éxitos españa playlist,éxitos españa
3346,PlayMusic,play my springtime playlist,springtime
3347,GetWeather,is there a lot of sun in qatar,sun qatar
3348,PlayMusic,play larry graham sound track,larry graham sound track
3349,GetWeather,will it be cold in chatmoss albania 8 years and a half from now,cold chatmoss albania 8 years and a half from now
3350,PlayMusic,play the top twenty tracks of ron jarzombek,top twenty tracks ron jarzombek
3351,PlayMusic,can you play some weird music from the noise genre,noise
3352,PlayMusic,play llegando a casa playlist,llegando a casa
3353,GetWeather,is it going to be nicer next week in hamel belize,next week hamel belize
3354,PlayMusic,play dhafer youssef top-twenty on netflix,dhafer youssef top-twenty netflix
3355,PlayMusic,play some amber kuo from the eighties on spotify,amber kuo eighties spotify
3356,PlayMusic,play tomtegubben som hade snuva,tomtegubben som hade snuva
3357,PlayMusic,i want to hear symphony songs from rebecca cartwright on last fm,symphony rebecca cartwright last fm
3358,PlayMusic,play some latin music,latin
3359,PlayMusic,play the newest phil stacey,newest phil stacey
3360,GetWeather,what s the weather on groundhog day in slovenia,groundhog day slovenia
3361,PlayMusic,play some origa on google music,origa google music
3362,GetWeather,is it chillier in baconton ky,chillier baconton ky
3363,PlayMusic,open last fm and play the top song from daniel lee chee hun,last fm top song daniel lee chee hun
3364,PlayMusic,use netflix to play a record by emil gilels from year 2015,netflix record emil gilels 2015
3365,GetWeather,what is the weather forecast for my current position,current position
3366,PlayMusic,open pandora and play udhreko choli from chowdiah,pandora udhreko choli chowdiah
3367,GetWeather,what will the weather be like at noon in brunei,noon brunei
3368,PlayMusic,play me hier encore by greydon square,hier encore greydon square
3369,PlayMusic,play dj kentaro from the year 1994,dj kentaro 1994
3370,GetWeather,tell me if it ll be chilly 1 second from now here,chilly 1 second from now here
3371,GetWeather,will it be overcast in south dakota,overcast south dakota
3372,PlayMusic,play steven reineke greatest soundtrack on youtube,steven reineke greatest soundtrack youtube
3373,PlayMusic,play thirties music by flex on google music,thirties flex google music
3374,GetWeather,what kind of weather will be in windy hills bermuda in ten weeks,windy hills bermuda in ten weeks
3375,GetWeather,what will the weather be in east new market antarctica,east new market antarctica
3376,GetWeather,what will the weather be like at my current spot on january the 19th,current spot january the 19th
3377,GetWeather,what is the weather here,here
3378,GetWeather,will it get windy in ocean breeze park,windy ocean breeze park
3379,PlayMusic,play music from the eighties on slacker,eighties slacker
3380,GetWeather,how cold is it in princeton junction,cold princeton junction
3381,PlayMusic,play long way to go by keita tachibana,long way to go keita tachibana
3382,GetWeather,what will the weather be like in killarney national park on national pow/mia recognition day,killarney national park national pow/mia recognition day
3383,PlayMusic,play the album sauna on zvooq,album sauna zvooq
3384,GetWeather,tell me the weather forecast for france,france
3385,PlayMusic,play solange 2016 album,2016 album
3386,PlayMusic,play the album have another ball,album have another ball
3387,PlayMusic,play the album a kiss before you go by bt,album a kiss before you go bt
3388,GetWeather,what is the weather forecast nearby sc,nearby sc
3389,GetWeather,tell me the forecast for breakfast at miller s cove,breakfast miller s cove
3390,PlayMusic,play some glenn stetson music on spotify,glenn stetson spotify
3391,GetWeather,will it be humid in beedeville on november 20,humid beedeville november 20
3392,GetWeather,will it be temperate near neylandville,temperate near neylandville
3393,GetWeather,weather for south williamsport,south williamsport
3394,GetWeather,what is the temperature in western sahara or within the same area three seconds from now,western sahara within the same area three seconds from now
3395,GetWeather,tell me if it ll be temperate three hours from now in bonaire,temperate three hours from now bonaire
3396,GetWeather,how warm will it be in 10 minutes,warm in 10 minutes
3397,GetWeather,what is the weather in richardson tanzania,richardson tanzania
3398,GetWeather,what s the forecast for gamaliel,gamaliel
3399,PlayMusic,play the last track by shavo odadjian,last track shavo odadjian
3400,GetWeather,weather in cairngorms-nationalpark close from freezing,cairngorms-nationalpark close from freezing
3401,PlayMusic,play maggot brain by albano carrisi,maggot brain albano carrisi
3402,GetWeather,what s the forecast far from here in turks and caicos islands,far here turks and caicos islands
3403,GetWeather,weather in one minute in norfolk island,in one minute norfolk island
3404,PlayMusic,play me leonid soybelman on vimeo,leonid soybelman vimeo
3405,GetWeather,what will the weather be like not far from alabama on may 9 2037,not far alabama may 9 2037
3406,PlayMusic,start playing my disney playlist,disney
3407,PlayMusic,i want to hear a fourties ballad by luciano,fourties ballad luciano
3408,GetWeather,what s the weather in the marshall islands in sixteen hours,marshall islands in sixteen hours
3409,PlayMusic,play music from 2012 on google music,2012 google music
3410,PlayMusic,play an album on netflix by chris castle from 2011,album netflix chris castle 2011
3411,GetWeather,tell me if snow is in the forecast for teterville,snow teterville
3412,GetWeather,hows the weather looking for kendall green maryland,kendall green maryland
3413,PlayMusic,play me a jill scott sound track on deezer,jill scott sound track deezer
3414,GetWeather,will the weather be colder in naguabo four minutes from now,colder naguabo four minutes from now
3415,PlayMusic,can you play me some eighties music by adele,eighties adele
3416,PlayMusic,play a top twenty symphony by bumble bee slim,top twenty symphony bumble bee slim
3417,PlayMusic,play a track by deeyah khan,track deeyah khan
3418,PlayMusic,want to play christina schollin lastfm,christina schollin lastfm
3419,GetWeather,what is the forecasted humidity in ghana for epiphany,humidity ghana epiphany
3420,GetWeather,what is the forecast for 9 seconds from now close by here,9 seconds from now close by here
3421,PlayMusic,play my madrugando playlist on groove shark,madrugando groove shark
3422,PlayMusic,play jono el grande from the thirties,jono el grande thirties
3423,GetWeather,how will the weather be in new mexico around 00:09:07 am,new mexico 00:09:07 am
3424,PlayMusic,play the good sort of 1992 theme music by layzie bone,good 1992 theme layzie bone
3425,PlayMusic,play a new ballad by valy on iheart,new ballad valy iheart
3426,PlayMusic,play 2gether by jade puget,2gether jade puget
3427,GetWeather,what kind of weather was forecast near harmony flats nature reserve last march,near harmony flats nature reserve last march
3428,PlayMusic,play shaina magdayao s music on iheart,shaina magdayao iheart
3429,PlayMusic,i want to hear a gucci mane song from last fm from 2002,gucci mane song last fm 2002
3430,GetWeather,what is the forecast for lille in norway,lille norway
3431,PlayMusic,play all of your toys by chris ledoux,all of your toys chris ledoux
3432,GetWeather,weather for my current location tomorrow,current location tomorrow
3433,PlayMusic,play music from youtube,youtube
3434,PlayMusic,play the top chant music from 2014,top chant 2014
3435,GetWeather,how will the weather be in six minutes close to moosic,in six minutes close moosic
3436,GetWeather,will it be sunny in corcovado indonesia,sunny corcovado indonesia
3437,PlayMusic,open up lastfm and play some songs,lastfm
3438,GetWeather,will it be warmer now in covenant life,warmer now covenant life
3439,GetWeather,will it get chillier here,chillier here
3440,GetWeather,will it be warmer in amnicon falls state park,warmer amnicon falls state park
3441,GetWeather,is it rainy at the edward l ryerson conservation area,rainy edward l ryerson conservation area
3442,PlayMusic,play good classified songs on vimeo,good classified vimeo
3443,GetWeather,will it be chillier in uruguay in 213 days,chillier uruguay in 213 days
3444,GetWeather,show weather forcast here at 19,here 19
3445,PlayMusic,play ciribiribin by sandeep khare,ciribiribin sandeep khare
3446,PlayMusic,play music off itunes,itunes
3447,PlayMusic,play the album have another ball,album have another ball
3448,GetWeather,is it going to be cold at 4 o clock far from here,cold 4 o clock far here
3449,GetWeather,what is the british virgin islands forecast for next november,british virgin islands next november
3450,PlayMusic,play music by ryan malcolm from sympathy for the devil on pandora,ryan malcolm sympathy for the devil pandora
3451,PlayMusic,play the song domino by luca turilli,song domino luca turilli
3452,PlayMusic,play a 2013 song on groove shark,2013 song groove shark
3453,PlayMusic,play slacker radio,slacker
3454,PlayMusic,play the album winner takes all by takuro with last fm,album winner takes all takuro last fm
3455,GetWeather,will it get cold in nevada seven weeks and a half from now,cold nevada seven weeks and a half from now
3456,GetWeather,is it going to be hotter in d lo,hotter d lo
3457,PlayMusic,play symphony music from 1991 by irvin mayfield,symphony 1991 irvin mayfield
3458,PlayMusic,play the last chris douglas on slacker,last chris douglas slacker
3459,GetWeather,what s the forecast for georgia,georgia
3460,GetWeather,what is the forecast for farmerville in cape verde,farmerville cape verde
3461,GetWeather,will it be hot in new york on october the 1st 2026,hot new york october the 1st 2026
3462,PlayMusic,play a keith richards album,keith richards album
3463,PlayMusic,i want to hear any top five music from gene autry,top five gene autry
3464,PlayMusic,play a movement fromthe eighties by nobuo uematsu,movement eighties nobuo uematsu
3465,PlayMusic,play a song by david silveria from 2002 on zvooq,song david silveria 2002 zvooq
3466,GetWeather,can you give me the forecast for 10:15 in paraguay,10:15 paraguay
3467,GetWeather,what was the weather last february in william a switzer provincial park,last february william a switzer provincial park
3468,GetWeather,weather for six am in sc,six am sc
3469,GetWeather,ethiopia ellenton has snow weather at eight pm,ethiopia ellenton snow eight pm
3470,GetWeather,how will the weather be in kentucky this week,kentucky this week
3471,PlayMusic,play a top twenty symphony by bumble bee slim,top twenty symphony bumble bee slim
3472,PlayMusic,play dj cameo on itunes,dj cameo itunes
3473,GetWeather,what will the weather be in mascoutah tanzania at 09:04:38 am,mascoutah tanzania 09:04:38 am
3474,GetWeather,show me the dresden weather forecast,dresden
3475,GetWeather,when will it be warmer in white horse mauritius,warmer white horse mauritius
3476,GetWeather,what s the weather in macclenny,macclenny
3477,PlayMusic,play a tune by andrew findon,tune andrew findon
3478,PlayMusic,play sixties theme music,sixties theme
3479,GetWeather,what is the forecast for bonner starting oct 24th 2025 for argentina,bonner oct 24th 2025 argentina
3480,PlayMusic,i want to hear a top-50 track from takahito eguchi on google music,top-50 track takahito eguchi google music
3481,PlayMusic,play a ballad from 1997,ballad 1997
3482,PlayMusic,play roland alphonso tunes that are most popular,roland alphonso most popular
3483,PlayMusic,play the happiest days of our lives by tommy emmanuel,the happiest days of our lives tommy emmanuel
3484,PlayMusic,play me some music by prince alla from the twenties,prince alla twenties
3485,GetWeather,what is the weather forecast for june the third in rileyville co,june the third rileyville co
3486,GetWeather,what is the predicted weather for wells in indiana,wells indiana
3487,PlayMusic,play music by damien rice,damien rice
3488,PlayMusic,can you play that last ep from the twenties,last ep twenties
3489,PlayMusic,play top-50 peter frampton songs,top-50 peter frampton
3490,GetWeather,book a restaurant on june the fifth in cavour,june the fifth cavour
3491,GetWeather,what does it feel like in east cove national wildlife refuge,east cove national wildlife refuge
3492,GetWeather,weather for faroe islands,faroe islands
3493,PlayMusic,i need to hear the new kevin fowler album,kevin fowler album
3494,PlayMusic,play music from 1989 by maya,1989 maya
3495,PlayMusic,play some drum & bass,drum & bass
3496,PlayMusic,play music by charlie adams from 1954,charlie adams 1954
3497,PlayMusic,play a tune by syreeta wright from twenties from the top,tune syreeta wright twenties top
