,Intent,Query,Param
0,PlayMusic,play the last song by goldie,last song goldie
1,GetWeather,will it be warmer at 15 o clock in deepwater bonaire,warmer 15 o clock deepwater bonaire
2,GetWeather,what is the weather in arkansas the city of morrison,arkansas morrison
3,GetWeather,whats the forecast for greece,greece
4,PlayMusic,want to hear a chant by nellie mckay from the year 2008,chant nellie mckay 2008
5,GetWeather,will it get chillier in arkinda myanmar,chillier arkinda myanmar
6,PlayMusic,play a cohesive playlist for me,cohesive
7,PlayMusic,i want to hear techno-industrial music,techno-industrial
8,PlayMusic,play some bertine zetlitz record,bertine zetlitz record
9,PlayMusic,play barry manilow from the twenties,barry manilow twenties
10,GetWeather,what will the weather be like here on dec 8 2019,here dec 8 2019
11,GetWeather,is it freezing near medley,freezing near medley
12,GetWeather,what will the weather be like on january 16 2030 in rainbow falls state park,january 16 2030 rainbow falls state park
13,GetWeather,what is the weather forecast in 2 seconds for south carolina,in 2 seconds south carolina
14,PlayMusic,play a record by black wall street records,record black wall street records
15,PlayMusic,let s listen to the most popular marty friedman songs on zvooq,most popular marty friedman zvooq
16,GetWeather,i need to know the weather seven weeks from now in morgan–monroe state forest,seven weeks from now morgan–monroe state forest
17,GetWeather,when it comes to dukes and the district of columbia what will the weather be in one hour,dukes district of columbia in one hour
18,GetWeather,will it be hotter in ct at 6 am,hotter ct 6 am
19,GetWeather,is it going to get windy today in tunisia,windy today tunisia
20,PlayMusic,play a martyn bennett from 1957 on pandora,martyn bennett 1957 pandora
21,GetWeather,what is the pw forecast for jul 9 in robert,pw jul 9 robert
22,PlayMusic,play slow rock music on vimeo,slow rock vimeo
23,GetWeather,what will the weather be ten minutes from now in canada,ten minutes from now canada
24,PlayMusic,play the track siberian khatru on zvooq,track siberian khatru zvooq
25,PlayMusic,play music from the seventies for me,seventies
26,GetWeather,will there be sun in the manassas national battlefield park,sun manassas national battlefield park
27,PlayMusic,please play music from itunes,itunes
28,PlayMusic,play some classical music on spotify,classical spotify
29,GetWeather,what is the weather supposed to be like in new jersey three months from now,new jersey three months from now
30,PlayMusic,i want to hear some theme music by edsel dope,theme edsel dope
31,PlayMusic,play some new age music,new age
32,GetWeather,what s the weather forecast for arizona city,arizona city
33,GetWeather,what aree the weather conditions not far from poneto,not far poneto
34,PlayMusic,play music from 2015,2015
35,PlayMusic,play some dj qbert,dj qbert
36,PlayMusic,can you use pandora to play a soundtrack from 1999 by david sitek,pandora soundtrack 1999 david sitek
37,GetWeather,will it be foggy now close to jolley,foggy now close jolley
38,GetWeather,will there be a fog here this week,here week
39,GetWeather,tell me the weather forecast 1 hour from now in big thicket national preserve,1 hour from now big thicket national preserve
40,PlayMusic,play some salsa music,salsa
41,GetWeather,what is the weather forecast close to puerto rico,close puerto rico
42,GetWeather,weather for marshall,marshall
43,PlayMusic,play a chaos of desire from dan snaith,a chaos of desire dan snaith
44,GetWeather,will there be a blizzard at a 4 am in sky valley,blizzard 4 am sky valley
45,PlayMusic,play the playlist feel good dinner,feel good dinner
46,PlayMusic,play ray davies on iheart by only hit it again,ray davies iheart hit it again
47,GetWeather,what is the forecast in mer rouge and palestine,mer rouge palestine
48,GetWeather,what is the forecast for temperate weather in bellechester,temperate bellechester
49,GetWeather,was the weather colder last august at stunt ranch santa monica mountains reserve,colder last august stunt ranch santa monica mountains reserve
50,PlayMusic,play the album axum,album axum
51,GetWeather,is it going to be cold once i get within walking distance of my home in new caledonia,cold within walking distance new caledonia
52,PlayMusic,play the energic itunes,energic itunes
53,PlayMusic,play iheart,iheart
54,PlayMusic,play some seventies track from top rie tomosaka,seventies track top rie tomosaka
55,GetWeather,what s the weather going to be like at 10:21:20 close by id,10:21:20 close by id
56,PlayMusic,give me some hank shermann from 1975 on lastfm,hank shermann 1975 lastfm
57,PlayMusic,play music by francis healy,francis healy
58,PlayMusic,play pura vida,pura vida
59,GetWeather,whats the weather in fernando new jersey,fernando new jersey
60,PlayMusic,play the tyranny of distance by willy mason,the tyranny of distance willy mason
61,PlayMusic,play the track siberian khatru on zvooq,track siberian khatru zvooq
62,PlayMusic,play chant music by pappu venugopala rao on slacker,chant pappu venugopala rao slacker
63,GetWeather,what is the forecast for january twenty-eighth in kentmore park,january twenty-eighth kentmore park
64,PlayMusic,play music by christian bautista,christian bautista
65,GetWeather,how cold is it going to be in san marcial ak in one second,cold san marcial ak in one second
66,GetWeather,how cold is it around the current location now,cold around current location now
67,GetWeather,tell me if it ll be chilly 1 second from now here,chilly 1 second from now here
68,GetWeather,will it be hotter netherlands antilles flats on april the 27th,hotter netherlands antilles flats april the 27th
69,PlayMusic,play soundtrack by armand van helden,soundtrack armand van helden
70,GetWeather,how s the weather in mowrystown,mowrystown
71,GetWeather,is it freezing at jasmund national park,freezing jasmund national park
72,GetWeather,what will the weather be in mattawan saint barthélemy,mattawan saint barthélemy
73,GetWeather,what s the weather in close by my current position,close by current position
74,GetWeather,i need the weather at eleven am in argentina,eleven am argentina
75,GetWeather,will it be even hotter 2 years from now in el jebel niger,hotter 2 years from now el jebel niger
76,GetWeather,what s the weather forecast near to fern creek this winter,near fern creek this winter
77,GetWeather,show cloud forcast in 1 hour in ia,cloud in 1 hour ia
78,PlayMusic,play a melody by avery storm,melody avery storm
79,GetWeather,will it be freezing 5 seconds from now in patmos,freezing 5 seconds from now patmos
80,GetWeather,how much hotter will it be here tomorrow,hotter here tomorrow
81,GetWeather,what s the weather in pennsylvania,pennsylvania
82,PlayMusic,i want to hear some of david gilmour s music from 1973,david gilmour 1973
83,GetWeather,will it be windy at 4 pm in ny,windy 4 pm ny
84,GetWeather,what is the forecast for the current place for sun on january sixth 2028 within walking distance,current place sun january sixth 2028 within walking distance
85,GetWeather,what is the weather forecast in brunei,brunei
86,GetWeather,what will the weather be in romania at 4,romania 4
87,GetWeather,is it going to hail in niger,hail niger
88,GetWeather,what is the forecast for here,here
89,PlayMusic,play music on netflix,netflix
90,GetWeather,i want food in zaleski,zaleski
91,GetWeather,want to know the hot weather situation in netherlands december 4,hot netherlands december 4
92,GetWeather,what is the weather forecast for djibouti,djibouti
93,PlayMusic,play the most popular ep by marcel khalife on netflix,most popular ep marcel khalife netflix
94,PlayMusic,play the playlist spring,spring
95,GetWeather,what is the weather forecast in country club heights,country club heights
96,GetWeather,warren island state park distant weather forecast for 11 am,warren island state park distant 11 am
97,GetWeather,forecast for morse shores kansas,morse shores kansas
98,GetWeather,will it be freezing close to my current location,freezing close current location
99,PlayMusic,play the playlist spring,spring
100,GetWeather,what s the weather forecast for tn on december seventh 2026,tn december seventh 2026
101,PlayMusic,play me a song by hank thompson from moa anbessa,song hank thompson moa anbessa
102,GetWeather,is it going to be chilly today in abo wi,chilly today abo wi
103,PlayMusic,play me a song from voices & images,song voices & images
104,GetWeather,what is the forecast here for september 16,here september 16
105,GetWeather,what s the weather in organ pipe cactus national monument,organ pipe cactus national monument
106,PlayMusic,i would like to hear music from 1993,1993
107,GetWeather,what is the weather like within walking distance of the bothwell lodge state historic site,within walking distance bothwell lodge state historic site
108,GetWeather,is it cloudy in the same area of lynn shore reservation,cloudy in the same area lynn shore reservation
109,PlayMusic,play the greatest 1972 album by wes dakus,greatest 1972 album wes dakus
110,PlayMusic,play lil hardin armstrong from itunes,lil hardin armstrong itunes
111,GetWeather,what s the weather forecast for the dominican republic,dominican republic
112,PlayMusic,play miyavi s music from seventies on google music,miyavi seventies google music
113,GetWeather,will the sun come out here,sun here
114,PlayMusic,play songs of heaven by ami koshimizu,songs of heaven ami koshimizu
115,PlayMusic,play murder the mountains by mana on netflix,murder the mountains mana netflix
116,GetWeather,what s the weather forecast for tomorrow around sankertown,tomorrow around sankertown
117,PlayMusic,play a concerto from sam sparro,concerto sam sparro
118,PlayMusic,play a movement from the nineties,movement nineties
119,PlayMusic,play some stephen jones on youtube,stephen jones youtube
120,GetWeather,what does it feel like in east cove national wildlife refuge,east cove national wildlife refuge
121,PlayMusic,play some rockwell from around 1996,rockwell 1996
122,GetWeather,will there be a storm in palm city wv,storm palm city wv
123,PlayMusic,play some dance music,dance
124,GetWeather,what is the american samoa forecast for hot weather,american samoa hot
125,PlayMusic,play some sister rosetta tharpe songs from the eighties,sister rosetta tharpe eighties
126,GetWeather,what is the weather forecast in langdon,langdon
127,GetWeather,what s the weather forecast for niue at two am,niue two am
128,GetWeather,what will the weather be like in louisiana will it be colder then now,louisiana colder now
129,PlayMusic,play hardcore music,hardcore
130,PlayMusic,play lukasz gottwald album on zvooq,lukasz gottwald album zvooq
131,GetWeather,what does it feel like in east cove national wildlife refuge,east cove national wildlife refuge
132,GetWeather,what is the weather like in wallis and futuna,wallis and futuna
133,GetWeather,what will the weather be in bernie id,bernie id
134,GetWeather,what s the weather in germantown hills,germantown hills
135,GetWeather,weather for my current location tomorrow,current location tomorrow
136,GetWeather,can you give me the weather for here,here
137,PlayMusic,play me some seventies music with a good melody,seventies good melody
138,GetWeather,will it be warm in hematite,warm hematite
139,GetWeather,what is the weather forecast one minute from now in macao,one minute from now macao
140,GetWeather,what s the weather forecast for tomorrow around sankertown,tomorrow around sankertown
141,PlayMusic,play me a song from 1972 by sweet emma barrett,song 1972 sweet emma barrett
142,PlayMusic,i want to listen to nineties chant songs,nineties chant
143,PlayMusic,play me some grunge music,grunge
144,GetWeather,is there a blizzard in tennessee colony ks,blizzard tennessee colony ks
145,PlayMusic,play an eighties track,eighties track
146,PlayMusic,play a 1999 track by pete seeger on youtube,1999 track pete seeger youtube
147,PlayMusic,please play jim martin on vimeo,jim martin vimeo
148,GetWeather,what will the weather be like may the 10th in rocky boy wi,may the 10th rocky boy wi
149,PlayMusic,i want to hear music on itunes,itunes
150,PlayMusic,can i hear a song by david hodges,song david hodges
151,GetWeather,book a restaurant 1 hour from now in dorchester shores reservation,1 hour from now dorchester shores reservation
152,PlayMusic,play a chant by mike jones,chant mike jones
153,GetWeather,what will the weather be like in 15 and a half weeks in china,in 15 and a half weeks china
154,GetWeather,how is the weather in oh,oh
155,GetWeather,will it be overcast in my current location at twelve pm,overcast current location twelve pm
156,GetWeather,will it be warm in chicamocha national park,warm chicamocha national park
157,PlayMusic,i want to hear some the roches,the roches
158,GetWeather,will it get hotter in the city of ashford,hotter ashford
159,PlayMusic,play the newest by exuma,newest exuma
160,PlayMusic,play vic ruggiero music from 2007,vic ruggiero 2007
161,PlayMusic,can you play some eighties music,eighties
162,PlayMusic,i want to hear a joel hastings melody,joel hastings melody
163,GetWeather,what will the weather be like in india at 02:55:25 am,india 02:55:25 am
164,PlayMusic,play a 1998 sound track from sam the kid on last fm,1998 sound track sam the kid last fm
165,PlayMusic,open pandora and play udhreko choli from chowdiah,pandora udhreko choli chowdiah
166,PlayMusic,play lily rosemary and the jack of hearts by chris goss,lily rosemary and the jack of hearts chris goss
167,GetWeather,will it rain here,rain here
168,PlayMusic,play new music from liang wern fook,new liang wern fook
169,GetWeather,check the forecast for natchaug state forest,natchaug state forest
170,PlayMusic,play moustapha amar make it rain,moustapha amar make it rain
171,GetWeather,what s the weather going to be like at my current spot at 7 am,current spot 7 am
172,GetWeather,what s the weather going to be like around lewis and clark trail sixteen hours from now,around lewis and clark trail sixteen hours from now
173,PlayMusic,play a ballad by owen pallett from the seventies on slacker,ballad owen pallett seventies slacker
174,PlayMusic,play music from lastfm and deezer,lastfm deezer
175,GetWeather,what s the weather forecast for my current position,current position
176,PlayMusic,play me something from the thirties by candi staton on vimeo,thirties candi staton vimeo
177,GetWeather,what is the weather like in the city of frewen in the country of venezuela,frewen venezuela
178,PlayMusic,play the newest sound track from the thirties,newest sound track thirties
179,PlayMusic,play the album everybody happy by lee aaron,album everybody happy lee aaron
180,GetWeather,i want the weather for saint martin next year,saint martin next year
181,PlayMusic,can you play the greatest songs by mauro picotto,greatest mauro picotto
182,PlayMusic,play me a song from luxury liner,song luxury liner
183,GetWeather,is it supposed to hail in ny,hail ny
184,PlayMusic,play some don ho on netflix,don ho netflix
185,PlayMusic,play a popular melody by lindsay lohan on youtube,popular melody lindsay lohan youtube
186,GetWeather,will it be colder in åland,colder åland
187,PlayMusic,play the top of emil de cou,top emil de cou
188,PlayMusic,play lighter by pamela jintana racine,lighter pamela jintana racine
189,GetWeather,what s the weather like nearby in rhode island,nearby rhode island
190,PlayMusic,play music which has humour on youtube,humour youtube
191,GetWeather,what is the expected weather forecast for beckley,beckley
192,GetWeather,is there a depression in delta junction,depression delta junction
193,GetWeather,what s the weather in singapore,singapore
194,GetWeather,what will the weather be in the current place 1 minute from now,current place 1 minute from now
195,GetWeather,what s the weather far away in estonia,far estonia
196,PlayMusic,play a melody by hagigat rzayeva,melody hagigat rzayeva
197,GetWeather,what is the weather forecast for shasha forest reserve in 43 weeks,shasha forest reserve in 43 weeks
198,PlayMusic,play spotify,spotify
199,PlayMusic,play some music from 2011 on lastfm,2011 lastfm
200,GetWeather,what s the forecast for mt next week,mt next week
201,GetWeather,whats the forecast for redby,redby
202,PlayMusic,play nineties,nineties
203,GetWeather,will there be a blizzard in chapel point state park or in the same area,blizzard chapel point state park in the same area
204,PlayMusic,play victoria banks s album,victoria banks album
205,GetWeather,will it be stormy in saint pierre and miquelon in the city of wenham,stormy saint pierre and miquelon wenham
206,PlayMusic,play khujo eighties track song,khujo eighties track song
207,PlayMusic,play out from under from hurricane chris,out from under hurricane chris
208,PlayMusic,play noche de chicas playlist,noche de chicas
209,PlayMusic,play some seventies songs from joseph genaro on google music,seventies joseph genaro google music
210,GetWeather,what will the weather be in fl on 1/11/2030,fl 1/11/2030
211,PlayMusic,play a keith richards album,keith richards album
212,PlayMusic,play a popular song by willie dixon on groove shark,popular song willie dixon groove shark
213,GetWeather,what will the weather be like on aug the 8th 2032 here,aug the 8th 2032 here
214,PlayMusic,play iheart,iheart
215,PlayMusic,play some sonu niigaam from the fifties,sonu niigaam fifties
216,PlayMusic,open lastfm and play hot lips page from the sixties,lastfm hot lips page sixties
217,GetWeather,what is the weather in the netherlands,netherlands
218,GetWeather,what is the baotianman national nature reserve forecast,baotianman national nature reserve
219,GetWeather,what is the weather forecast for sunset in bouvet island,sunset bouvet island
220,PlayMusic,play the top-ten soundtrack from kiara,top-ten soundtrack kiara
221,PlayMusic,please play something that s freak folk on google music,freak folk google music
222,GetWeather,what will be the weather like close by kackley,close kackley
223,PlayMusic,use youtube to play music from dorothy ashby from the year 2002,youtube dorothy ashby 2002
224,GetWeather,what will the weather be like at me current position in seventeen seconds,current position in seventeen seconds
225,GetWeather,will it be hot in keachi,hot keachi
226,PlayMusic,play some rap on pandora,rap pandora
227,PlayMusic,play the it could only happen with you album by lawrence,it could only happen with you album lawrence
228,GetWeather,will it get chillier in furano-ashibetsu prefectural natural park,chillier furano-ashibetsu prefectural natural park
229,PlayMusic,play the top jazz record from 1951,top record 1951
230,GetWeather,what will the weather be in worthington springs,worthington springs
231,PlayMusic,play the album remember shakti – the believer,album remember shakti – the believer
232,PlayMusic,play me something on last fm,last fm
233,PlayMusic,play play lodge by alkabli on lastfm,lodge alkabli lastfm
234,PlayMusic,play the best bruce ruffin music on youtube,best bruce ruffin youtube
235,PlayMusic,play a tune by layne staley,tune layne staley
236,GetWeather,tell me the weather for comertown,comertown
237,PlayMusic,play a concerto top ten sort by lloyd,concerto top ten lloyd
238,GetWeather,how will the weather be in new mexico around 00:09:07 am,new mexico 00:09:07 am
239,PlayMusic,play by the sleepy lagoon by greg kurstin,by the sleepy lagoon greg kurstin
240,GetWeather,what s the weather in taiwan,taiwan
241,GetWeather,is it freezing at jasmund national park,freezing jasmund national park
242,PlayMusic,play some twenties chant music on slacker,twenties chant slacker
243,GetWeather,what is the forecast for west virginia will it be snowy,west virginia snowy
244,GetWeather,what will be the wind speed around pembina gorge state recreation area october the 27th,wind pembina gorge state recreation area october the 27th
245,GetWeather,what s the weather forecast at sixteen in oklahoma,sixteen oklahoma
246,PlayMusic,play my piano ballads playlist,piano ballads
247,PlayMusic,give me an album from 1972 to listen to,album 1972
248,PlayMusic,play a 1969 ballad by beth nielsen chapman new first,1969 ballad beth nielsen chapman new
249,GetWeather,what is the cold forecast for our current position,cold current position
250,PlayMusic,play the next ep by video game pianist on netflix,ep video game pianist netflix
251,PlayMusic,play glenn yarbrough tunes,glenn yarbrough
252,PlayMusic,play sivamani,sivamani
253,GetWeather,tell me the weather forecast for june seventeenth 2034 in fl,june seventeenth 2034 fl
254,GetWeather,is it chillier here,chillier here
255,PlayMusic,play a top fifty ballad by linda strawberry on google music,top fifty ballad linda strawberry google music
256,PlayMusic,open itunes and play kenny cox most popular concerto,itunes kenny cox most popular concerto
257,GetWeather,is it going to be hot in karthaus at 7 am,hot karthaus 7 am
258,GetWeather,will it be overcast in luxembourg in fourteen seconds,overcast luxembourg in fourteen seconds
259,GetWeather,what will be the weather like close by kackley,close kackley
260,PlayMusic,play randy castillo s music from 1952,randy castillo 1952
261,GetWeather,what s the weather forecast for my current spot in eight hours,current spot in eight hours
262,GetWeather,will the weather be the same here in one week in the same area,same here in one week in the same area
263,GetWeather,what is the weather now in james city,now james city
264,GetWeather,is it going to be freezing in lolita,freezing lolita
265,GetWeather,what s the weather in andorra,andorra
266,GetWeather,will it be hotter next month in south dakota,hotter next month south dakota
267,PlayMusic,play rocket queen on itunes,rocket queen itunes
268,PlayMusic,play the best music by arthur johnston,best arthur johnston
269,PlayMusic,play my melodious playlist,melodious
270,GetWeather,tell me when it will be warmer in my current position,warmer current position
271,PlayMusic,play addicted to you by hank ballard,addicted to you hank ballard
272,PlayMusic,play sivamani,sivamani
273,PlayMusic,i want to hear some twenties music off of deezer,twenties deezer
274,GetWeather,what is the weather close-by my current spot,close-by current spot
275,PlayMusic,can you play an ep from the year 1958,ep 1958
276,PlayMusic,play crazy=genius by the alchemist,crazy=genius the alchemist
277,GetWeather,what will the weather be in port costa fm will it be foggy,port costa fm foggy
278,GetWeather,is there snowfall in zec mitchinamecus at 13,snowfall zec mitchinamecus 13
279,GetWeather,when is sunrise in american samoa,sunrise american samoa
280,GetWeather,will there be a lot of sun in dry prong somalia at 5 pm,sun dry prong somalia 5 pm
281,GetWeather,what will the weather be like four seconds from now in south dakota,four seconds from now south dakota
282,GetWeather,will it hail in rush valley denmark on 6/21/2035,hail rush valley denmark 6/21/2035
283,PlayMusic,play the top-fifty theme songs by dennis brown,top-fifty theme dennis brown
284,PlayMusic,open lastfm and start playing whatever,lastfm
285,GetWeather,is it going to be windy here on nov 17,windy here nov 17
286,PlayMusic,open deezer and play top 40 hits,deezer top
287,GetWeather,give me the weather forecast for the city of archie,archie
288,PlayMusic,i wish to enjoy some fifties music by johnny paycheck,fifties johnny paycheck
289,PlayMusic,i want to hear a top-50 track from takahito eguchi on google music,top-50 track takahito eguchi google music
290,GetWeather,is there any predicted snowfall in 2 months in vandalia el salvador,snowfall in 2 months vandalia el salvador
291,PlayMusic,play tad kinchla soundtrack,tad kinchla soundtrack
292,PlayMusic,play a new ballad by valy on iheart,new ballad valy iheart
293,GetWeather,what s the weather 1 minute from now in mount nimba strict nature reserve,1 minute from now mount nimba strict nature reserve
294,GetWeather,give me the weather forecast for lower lake on sep 21 2038,lower lake sep 21 2038
295,PlayMusic,play a twenties soundtrack on youtube,twenties soundtrack youtube
296,PlayMusic,play stefon harris s song,stefon harris song
297,GetWeather,how is the weather going to be in pearblossom,pearblossom
298,GetWeather,show weather forcast here at 19,here 19
299,PlayMusic,play me the new king curtis music on google music,new king curtis google music
300,PlayMusic,play music from 1977,1977
301,PlayMusic,play a song from 2013,song 2013
302,GetWeather,how s the weather going to be on jul 2 in whiteside,jul 2 whiteside
303,PlayMusic,i would like to hear music from 1993,1993
304,GetWeather,what will the weather be in worthington springs,worthington springs
305,GetWeather,what is the weather like for fleischmanns lesotho 43 weeks from now,fleischmanns lesotho 43 weeks from now
306,PlayMusic,play music from jeremy taylor on the album dormi amore la situazione non è buona on groove shark,jeremy taylor album dormi amore la situazione non è buona groove shark
307,PlayMusic,play the top ten theme music from 1975 by tom baxter,top ten theme 1975 tom baxter
308,PlayMusic,play the new timer by augustus pablo with itunes,the new timer augustus pablo itunes
309,GetWeather,will it be overcast a month from now here,overcast a month from now here
310,GetWeather,will there be rainfall faraway from uganda,rainfall faraway uganda
311,PlayMusic,play 1990 tunes on groove shark,1990 groove shark
312,GetWeather,what s the weather going to be in jun in burkina,jun burkina
313,GetWeather,this month will the sun be scorching in la,this month sun la
314,PlayMusic,play music on the playlist electronic gaming,electronic gaming
315,GetWeather,weather for park narodowy kushiro-shitsugen,park narodowy kushiro-shitsugen
316,GetWeather,is the weather overcast here and now,overcast here now
317,GetWeather,what s the weather in swift river reservation,swift river reservation
