,Intent,Query,Param
5057,PlayMusic,play some sam moore,sam moore
5058,GetWeather,i d like to see weather conditions for ennis,ennis
5059,PlayMusic,play the playlist introspective,introspective
5060,GetWeather,what is the forecast for cold temps in nevada,cold nevada
5061,PlayMusic,play a fifties theme on lastfm,fifties theme lastfm
5062,PlayMusic,play some techno on lastfm,techno lastfm
5063,GetWeather,is it forecast to be chillier around texas,chillier around texas
5064,PlayMusic,let me listen to rouhollah khaleghi on deezer,rouhollah khaleghi deezer
5065,PlayMusic,play a track from 1985,track 1985
5066,GetWeather,how is colder in city of rocks state park around 03:43 pm,colder city of rocks state park 03:43 pm
5067,PlayMusic,play drum & bass music,drum & bass
5068,GetWeather,what is the weather going to be at dinner time in the lake le-aqua-na state recreation area,dinner lake le-aqua-na state recreation area
5069,PlayMusic,play something by louis nelson delisle,louis nelson delisle
5070,PlayMusic,play some music from 2011 on lastfm,2011 lastfm
5071,GetWeather,what s the weather like in big delta,big delta
5072,PlayMusic,play satire music,satire
5073,PlayMusic,can you play some music from my road trip album,road trip album
5074,PlayMusic,play slacker tunes,slacker
5075,PlayMusic,play music from the seventies,seventies
5076,GetWeather,i d like the weather forecast for albania,albania
5077,PlayMusic,please play me jerry lee lewis s if you say so track,jerry lee lewis if you say so track
5078,GetWeather,what s the weather in niagara,niagara
5079,PlayMusic,i want to hear the top 5 jamie lidell songs,top 5 jamie lidell
5080,GetWeather,i need to know the weather for san martin,san martin
5081,GetWeather,how s the weather going to be on jul 2 in whiteside,jul 2 whiteside
5082,PlayMusic,play me a song from the fourties,song fourties
5083,GetWeather,will it be colder at five o clock at the apolobamba integrated management natural area,colder five o clock apolobamba integrated management natural area
5084,GetWeather,what will the weather be like in samoa at 6 pm,samoa 6 pm
5085,PlayMusic,can you play a song from the newest movement by prince on lastfm,song newest movement prince lastfm
5086,GetWeather,is it supposed to be sunny here,sunny here
5087,PlayMusic,play stereo by jonathan davis on deezer,stereo jonathan davis deezer
5088,GetWeather,is it windy in june park,windy june park
5089,PlayMusic,play johnny gimble,johnny gimble
5090,GetWeather,is it hot in the current location,hot current location
5091,PlayMusic,play any nineties music,nineties
5092,GetWeather,what s the weather forecast for baker city,baker city
5093,PlayMusic,play dancing through life by ronald isley on spotify,dancing through life ronald isley spotify
5094,GetWeather,weather for carlisle gardens as,carlisle gardens as
5095,PlayMusic,play a sound track by pee wee russell on zvooq,sound track pee wee russell zvooq
5096,PlayMusic,play my still got the blues playlist,still got the blues
5097,GetWeather,what will the weather be for hooksett,hooksett
5098,GetWeather,will it be overcast in seventeen minutes in the united arab emirates,overcast in seventeen minutes united arab emirates
5099,PlayMusic,play cherry pink by trapp mendoza on iheart,cherry pink trapp mendoza iheart
5100,GetWeather,weather here at two pm,here two pm
5101,GetWeather,will it get cold in nevada seven weeks and a half from now,cold nevada seven weeks and a half from now
5102,PlayMusic,play the greatest james yorkston song,greatest james yorkston song
5103,GetWeather,what will the weather be for hooksett,hooksett
5104,GetWeather,what s the weather in kiahsville in the cayman islands,kiahsville cayman islands
5105,GetWeather,tell me the weather forecast in greensburg,greensburg
5106,PlayMusic,i d like to hear one of eric clapton s most popular melody on pandora,eric clapton most popular melody pandora
5107,GetWeather,will it rain in six weeks in libby,rain in six weeks libby
5108,PlayMusic,please play the most popular ep from 1998 by mc frontalot,most popular ep 1998 mc frontalot
5109,GetWeather,in california will it be cold in east trenton heights,california cold east trenton heights
5110,PlayMusic,play me a maia hirasawa soundtrack from 1951,maia hirasawa soundtrack 1951
5111,PlayMusic,play a song from helena iren michaelsen on spotify,song helena iren michaelsen spotify
5112,GetWeather,what s the weather in guatemala,guatemala
5113,GetWeather,is it humid in kuwait,humid kuwait
5114,PlayMusic,use slacker to listen to seventies music,slacker seventies
5115,PlayMusic,play a music theme by anna nikolajewna jessipowa,theme anna nikolajewna jessipowa
5116,GetWeather,will there be a snowstorm this weekend in bear river arizona,snowstorm weekend bear river arizona
5117,PlayMusic,play noche de chicas playlist,noche de chicas
5118,GetWeather,is it forecast to be stormy close to nimule-nationalpark 1 hour from now,stormy close nimule-nationalpark 1 hour from now
5119,PlayMusic,open deezer and play top 40 hits,deezer top
5120,GetWeather,is it supposed to hail in rosenberg in the french polynesia,hail rosenberg french polynesia
5121,PlayMusic,please play good music by will oldham,good will oldham
5122,GetWeather,find the weather prediction for camdeboo-nationalpark for jan eleventh 2037,camdeboo-nationalpark jan eleventh 2037
5123,GetWeather,need a table now somewhere nearby petit manan national wildlife refuge,now nearby petit manan national wildlife refuge
5124,GetWeather,weather in cairngorms-nationalpark close from freezing,cairngorms-nationalpark close from freezing
5125,PlayMusic,play music by vybz kartel,vybz kartel
5126,GetWeather,what s the weather in heritage hill state historical park,heritage hill state historical park
5127,PlayMusic,play 25 to life by paul riley on deezer,25 to life paul riley deezer
5128,GetWeather,will it be chillier in portugal in one hour,chillier portugal in one hour
5129,GetWeather,what is the temperate in uintah right now,temperate uintah now
5130,GetWeather,is it forecast to be hot in greenland this winter,hot greenland this winter
5131,GetWeather,what is the weather in åland 4 seconds from now,åland 4 seconds from now
5132,PlayMusic,play 1981 tunes by jiles perry richardson on lastfm for theme music,1981 jiles perry richardson lastfm theme
5133,GetWeather,will it get chillier in 12 years in greenland,chillier in 12 years greenland
5134,GetWeather,will there be a fog here this week,here week
5135,PlayMusic,please play me a top nineties theme song,top nineties theme song
5136,PlayMusic,play an asha bhosle song from around 1964,asha bhosle song 1964
5137,GetWeather,what is the pw forecast for jul 9 in robert,pw jul 9 robert
5138,GetWeather,what is the forecast for orienta for hotter weather,orienta hotter
5139,GetWeather,will there be snowfall in pacific beach suriname,snowfall pacific beach suriname
5140,GetWeather,tell me the weather forecast close to romania,close romania
5141,GetWeather,what will the weather be like in nickelsville,nickelsville
5142,GetWeather,what is the weather forecast for july 20 2020 in dachigam-nationalpark,july 20 2020 dachigam-nationalpark
5143,GetWeather,is it warm in sierra blanca now,warm sierra blanca now
5144,PlayMusic,play music from lastfm,lastfm
5145,PlayMusic,play fourties tunes,fourties
5146,GetWeather,tell me what the weather will look like here at 01:50,here 01:50
5147,GetWeather,what is the weather forecast for manassa,manassa
5148,GetWeather,can you give me a forecast for weather at night in my current position,night current position
5149,GetWeather,tell me the weather forecast one second from now in barnum island,one second from now barnum island
5150,GetWeather,will it rain in barberville,rain barberville
5151,PlayMusic,play some chant from 1974,chant 1974
5152,PlayMusic,play any song from 2001,song 2001
5153,GetWeather,will it be warm in cotati in guinea-bissau,warm cotati guinea-bissau
5154,GetWeather,give me the weather forecast for somiedo natural park,somiedo natural park
5155,PlayMusic,play a melody by adassa from the twenties,melody adassa twenties
5156,GetWeather,is it going to rain in kansas by march 4,rain kansas march 4
5157,GetWeather,weather for james m robb – colorado river state park,james m robb – colorado river state park
5158,PlayMusic,play the playlist spring,spring
5159,GetWeather,can you tell me the forecast for east falmouth hungary,east falmouth hungary
5160,PlayMusic,play some 1991 dave barker,1991 dave barker
5161,GetWeather,what s the weather going to be in jun in burkina,jun burkina
5162,PlayMusic,play me a nineties song by joseph genaro,nineties song joseph genaro
5163,GetWeather,will it be cold in boyertown new zealand in eighteen hours,cold boyertown new zealand in eighteen hours
5164,PlayMusic,play music by vybz kartel,vybz kartel
5165,PlayMusic,play music from 1969 on lastfm,1969 lastfm
5166,PlayMusic,list to the most popular muireann nic amhlaoibh song,most popular muireann nic amhlaoibh song
5167,GetWeather,is it going to be chillier in new mexico this spring,chillier new mexico this spring
5168,PlayMusic,play a top symphony from the fourties,top symphony fourties
5169,GetWeather,what is the forecast for here,here
5170,PlayMusic,play an eighties song by ler lalonde,eighties song ler lalonde
5171,GetWeather,is temperature in hanksville freezing,hanksville freezing
5172,GetWeather,what is the weather in twenty three minutes in nv,in twenty three minutes nv
5173,PlayMusic,play a symphonic rock on pandora,symphonic rock pandora
5174,PlayMusic,play the album axum,album axum
5175,GetWeather,what is the weather forecast for here,here
5176,PlayMusic,i d like to listen to space music,space
5177,PlayMusic,play rocket queen on itunes,rocket queen itunes
5178,PlayMusic,play the galway races on netflix,the galway races netflix
5179,GetWeather,what is the forecast for bad branch falls state nature preserve for in 1 hour and 14 seconds,bad branch falls state nature preserve in 1 hour and 14 seconds
5180,GetWeather,will it get chillier in north creek forest,chillier north creek forest
5181,GetWeather,is there any predicted snowfall in 2 months in vandalia el salvador,snowfall in 2 months vandalia el salvador
5182,GetWeather,what is the pw forecast for jul 9 in robert,pw jul 9 robert
5183,GetWeather,is the forecast chillier in 1 hour in mali,chillier in 1 hour mali
5184,PlayMusic,play symphony music from joe dolce,symphony joe dolce
5185,GetWeather,will the weather be okay in northern luzon heroes hill national park 4 and a half months from now,northern luzon heroes hill national park 4 and a half months from now
5186,GetWeather,will the weather be cloudy at 0 pm at my current position,cloudy 0 pm current position
5187,PlayMusic,play twenties symphony from robert walter,twenties symphony robert walter
5188,GetWeather,what is the weather forecast here one minute from now,here one minute from now
5189,GetWeather,will there be rain today in greece,rain today greece
5190,PlayMusic,play my funtime playlist on lastfm,funtime lastfm
5191,PlayMusic,play me a fifties song by chingy,fifties song chingy
5192,PlayMusic,play good music by general woo on deezer,good general woo deezer
5193,PlayMusic,play the album killer instinkt,album killer instinkt
5194,PlayMusic,play the greatest record by leroi moore,greatest record leroi moore
5195,GetWeather,will it be chilly in ma 12 days from now,chilly ma 12 days from now
5196,PlayMusic,play a ballad from 1997,ballad 1997
5197,GetWeather,when will it be temperate in lansford,temperate lansford
5198,PlayMusic,play the song american patrol by lauryn hill,song american patrol lauryn hill
5199,GetWeather,is it warmer in monson u s minor outlying islands,warmer monson u s minor outlying islands
5200,GetWeather,what is the forecast for cloudy weather here,cloudy here
5201,GetWeather,what is the weather going to be like in reidland new mexico next jun,reidland new mexico next jun
5202,GetWeather,will there be wind in loyola,wind loyola
5203,GetWeather,check the weather for eagle harbor tanzania,eagle harbor tanzania
5204,PlayMusic,play the trail of the lonesome pine on netflix,the trail of the lonesome pine netflix
5205,PlayMusic,play iheart,iheart
5206,GetWeather,is it warm in albania at noon,warm albania noon
5207,PlayMusic,play dancing through life by ronald isley on spotify,dancing through life ronald isley spotify
5208,PlayMusic,play me a song from luxury liner,song luxury liner
5209,PlayMusic,play a song off get up offa that thing by doseone on last fm,song get up offa that thing doseone last fm
5210,PlayMusic,use the service zvooq to play merengue music,zvooq merengue
5211,GetWeather,what is the meal time forecast for cayman islands,meal cayman islands
5212,GetWeather,is there a storm in maliau-basin-conservation-area now,storm maliau-basin-conservation-area now
5213,GetWeather,need weather forecast for stacy in vanuatu,stacy vanuatu
5214,PlayMusic,open deezer and search for scott miller and play some of his new songs,deezer scott miller new
5215,PlayMusic,play some 1999 symphony from minami takahashi,1999 symphony minami takahashi
5216,GetWeather,what is the forecast for mar 8th in friesland tennessee,mar 8th friesland tennessee
5217,PlayMusic,play some twenties theme music on google music,twenties theme google music
5218,GetWeather,will it be stormy not far from id on 10/2/2021,stormy not far id 10/2/2021
5219,PlayMusic,play top-50 peter frampton songs,top-50 peter frampton
5220,PlayMusic,play a track by alpha blondy with deezer,track alpha blondy deezer
5221,GetWeather,what is the weather forecast in country club heights,country club heights
5222,GetWeather,what is the weather forecast for june the third in rileyville co,june the third rileyville co
5223,GetWeather,show weather forecast for lewis center,lewis center
5224,GetWeather,what s the weather forecast for here,here
5225,PlayMusic,play white noise,white noise
5226,PlayMusic,play 1966 theme music on slacker,1966 theme slacker
5227,PlayMusic,listen to pmd symphony,pmd symphony
5228,GetWeather,what s the forecast for little silver,little silver
5229,PlayMusic,lets hear some 2009 music,2009
5230,PlayMusic,play a track from 1985,track 1985
5231,GetWeather,what is the weather forecast for tanque,tanque
5232,PlayMusic,play some fourties andrew lloyd webber on groove shark,fourties andrew lloyd webber groove shark
5233,PlayMusic,play me some goa,goa
5234,GetWeather,will it be warmer in saint louis park,warmer saint louis park
5235,PlayMusic,play symphony music from 1991 by irvin mayfield,symphony 1991 irvin mayfield
5236,GetWeather,is it hotter close by waubay,hotter close by waubay
5237,GetWeather,what will the weather be in montserrat,montserrat
5238,PlayMusic,let me hear the rave tapes album from yuki koyanagi,rave tapes album yuki koyanagi
5239,GetWeather,is it hotter here,hotter here
5240,GetWeather,what s the weather forecast for tomorrow around sankertown,tomorrow around sankertown
5241,GetWeather,will it be colder in oaklawn zambia,colder oaklawn zambia
5242,PlayMusic,play the best bruce ruffin music on youtube,best bruce ruffin youtube
5243,GetWeather,how is colder in city of rocks state park around 03:43 pm,colder city of rocks state park 03:43 pm
5244,GetWeather,what is the humidity in serbia,humidity serbia
5245,GetWeather,how will the weather be at 8 am in ct,8 am ct
5246,PlayMusic,play a top twenty sort by akinyele,top twenty akinyele
5247,PlayMusic,play a top twenty sort by akinyele,top twenty akinyele
5248,GetWeather,what is the weather forecast tomorrow in french ut,tomorrow french ut
5249,PlayMusic,i need to hear some music from spotify,spotify
5250,GetWeather,is it humid in kuwait,humid kuwait
5251,GetWeather,will it be chillier in suwannee,chillier suwannee
5252,PlayMusic,play prints in the stone by helen baylor,prints in the stone helen baylor
5253,PlayMusic,play wow by jon theodore,wow jon theodore
5254,GetWeather,what will the weather be like in nickelsville,nickelsville
5255,PlayMusic,play a top-five song by pete candoli,top-five song pete candoli
5256,GetWeather,is it going to be snowy in ochopee massachusetts,snowy ochopee massachusetts
5257,PlayMusic,play justin broadrick s music on slacker,justin broadrick slacker
5258,PlayMusic,play some music by karl blau,karl blau
5259,PlayMusic,play march of the soviet tankmen from gloria gaither,march of the soviet tankmen gloria gaither
5260,PlayMusic,play new melody by kenji ito on itunes,new melody kenji ito itunes
5261,PlayMusic,i want to hear sebastian s songs from the thirties on youtube,sebastian thirties youtube
5262,GetWeather,what will the weather be in wakarusa,wakarusa
5263,PlayMusic,play some grunge,grunge
5264,GetWeather,what s the weather in totowa wy one minute from now,totowa wy one minute from now
5265,PlayMusic,play some chant music from 2008,chant 2008
5266,PlayMusic,play the monkeys have no tails in zamboanga on google music,the monkeys have no tails in zamboanga google music
5267,PlayMusic,play the album resurrection in blood from sleepy brown on itunes,album resurrection in blood sleepy brown itunes
5268,GetWeather,forecast for samoa next sat,samoa next sat
5269,GetWeather,what s the weather here,here
5270,PlayMusic,play some thrash metal,thrash metal
5271,PlayMusic,use the service lastfm to play music by the artist ai kago,lastfm ai kago
5272,PlayMusic,play 90s love songs on youtube,90s love songs youtube
5273,PlayMusic,play safe rock and roll sucks on lastfm,safe rock and roll sucks lastfm
5274,GetWeather,is it temperate in the current location now,temperate current location now
5275,PlayMusic,play play lodge by alkabli on lastfm,lodge alkabli lastfm
5276,PlayMusic,can you play a song from the newest movement by prince on lastfm,song newest movement prince lastfm
5277,PlayMusic,can you play a song off an album by shirley horn,song album shirley horn
5278,PlayMusic,i want to hear some music from spotify,spotify
5279,GetWeather,what s the weather close-by triumph,close-by triumph
5280,PlayMusic,play the top of emil de cou,top emil de cou
5281,GetWeather,is it going to be humid faraway from here around dinner time,humid faraway here around dinner
5282,GetWeather,please give me the weather for federated states of micronesia,federated states of micronesia
5283,GetWeather,is the weather freezing in ak,freezing ak
5284,GetWeather,what is the forecast for a day from now in liechtenstein,a day from now liechtenstein
5285,PlayMusic,play the monkeys have no tails in zamboanga on google music,the monkeys have no tails in zamboanga google music
5286,GetWeather,will there be a snowfall here in the neighboring areas,snowfall here neighboring
5287,GetWeather,how cold is it around the current location now,cold around current location now
5288,PlayMusic,play my hardstyle baby playlist on netflix,hardstyle baby netflix
5289,GetWeather,how much rainfall is there faraway from douglass,rainfall faraway douglass
5290,PlayMusic,play robert stoddard from 1988,robert stoddard 1988
5291,PlayMusic,play theme music from the twenties by tata young,theme twenties tata young
5292,GetWeather,what will the weather be like in three weeks faraway in sompio strict nature reserve,in three weeks faraway sompio strict nature reserve
5293,GetWeather,what is the forecast next year in mcgee,next year mcgee
5294,PlayMusic,play top-twenty fourties movement music by mohammad reza lotfi,top-twenty fourties movement mohammad reza lotfi
5295,GetWeather,will there be a snowstorm in william b ide adobe state historic park,snowstorm william b ide adobe state historic park
5296,GetWeather,what is the forecasted humidity in ghana for epiphany,humidity ghana epiphany
5297,GetWeather,is it hot in the current location,hot current location
5298,PlayMusic,i want to hear some acid punk music,acid punk
5299,PlayMusic,play the greatest music you can find by ari herstand on zvooq,greatest ari herstand zvooq
5300,GetWeather,will it get cold in nationalpark mu ko phetra,cold nationalpark mu ko phetra
5301,GetWeather,is it chillier here,chillier here
5302,PlayMusic,play a 2013 song on groove shark,2013 song groove shark
5303,GetWeather,what is the temperature at eifel national park,eifel national park
5304,PlayMusic,play a song off the best of siouxsie & the banshees by faustino oramas,song the best of siouxsie & the banshees faustino oramas
5305,PlayMusic,listen to music from 1975,1975
5306,PlayMusic,play pop,pop
5307,PlayMusic,play something from the twenties on lastfm,twenties lastfm
5308,GetWeather,will it get cold in nevada seven weeks and a half from now,cold nevada seven weeks and a half from now
5309,GetWeather,what s the weather in hi,hi
5310,PlayMusic,play some music by daniel carter,daniel carter
5311,PlayMusic,play zvooq latest track by peter appleyard,zvooq latest track peter appleyard
5312,GetWeather,weather at breakfast in montana,breakfast montana
5313,PlayMusic,play a top-twenty tune by noor jehan,top-twenty tune noor jehan
5314,GetWeather,weather forecast for snowstorm on feb fourth in virgin islands,snowstorm feb fourth virgin islands
5315,GetWeather,will it be hot in the cayman islands on november 12th 2035,hot cayman islands november 12th 2035
5316,PlayMusic,i want to hear some music from spotify,spotify
5317,PlayMusic,play a karin dreijer andersson soundtrack on groove shark,karin dreijer andersson soundtrack groove shark
5318,PlayMusic,play music from 1964,1964
5319,GetWeather,what are the weather conditions going to be like in manhasset vermont on dec the 6th 2036,manhasset vermont dec the 6th 2036
5320,PlayMusic,play a song of i myself and me on youtube,song i myself and me youtube
5321,PlayMusic,open itunes and play bad attitude,itunes bad attitude
5322,PlayMusic,play me the new king curtis music on google music,new king curtis google music
5323,GetWeather,will the weather be warm in the nationaal park band-e amir at twelve am,warm nationaal park band-e amir twelve am
5324,PlayMusic,i wish to enjoy some fifties music by johnny paycheck,fifties johnny paycheck
5325,PlayMusic,play songs by naomi schemer,naomi schemer
5326,PlayMusic,play a morton downey record with slacker,morton downey record slacker
5327,PlayMusic,open groove shark and play jason mizell,groove shark jason mizell
5328,GetWeather,will it snow this week in parc national de petrified forest,snow this week parc national de petrified forest
5329,PlayMusic,play barbra streisand music from 1997,barbra streisand 1997
5330,GetWeather,how much wind will there be in nm on november 11th,wind nm november 11th
5331,PlayMusic,play good pure soul on netflix,good pure soul netflix
5332,GetWeather,is the forecast colder in idaho 1 second from now,colder idaho 1 second from now
5333,GetWeather,tell me the weather forecast for huxley ms,huxley ms
5334,PlayMusic,play me the newest fourties symphony,newest fourties symphony
5335,PlayMusic,play me a song by saki nakajima,song saki nakajima
5336,GetWeather,what s the weather in oregon,oregon
5337,PlayMusic,play some nineties music on zvooq,nineties zvooq
5338,PlayMusic,play the most popular coti songs on pandora,most popular coti pandora
5339,PlayMusic,play the most popular album on google music by sasu ripatti,most popular album google music sasu ripatti
5340,PlayMusic,play the top of emil de cou,top emil de cou
5341,PlayMusic,play my mellow beats playlist please,mellow beats
5342,GetWeather,will it storm in kinder russia,storm kinder russia
5343,GetWeather,what s the weather forecast not far from here,not far here
5344,GetWeather,how is the weather going to be this week in roseau ia,this week roseau ia
5345,GetWeather,what is the weather forecast here one minute from now,here one minute from now
5346,PlayMusic,play music from negerpunk,negerpunk
5347,GetWeather,tell me the weather forecast for june seventeenth 2034 in fl,june seventeenth 2034 fl
5348,GetWeather,how will the weather be in six and a half months in co,in six and a half months co
5349,GetWeather,will there be rain in 8 minutes in md,rain in 8 minutes md
5350,GetWeather,what is the weather of pine city,pine city
5351,PlayMusic,play the last song from the thirties by airto moreira,last song thirties airto moreira
5352,PlayMusic,i want to hear some boris grebenchtchikov on zvooq,boris grebenchtchikov zvooq
5353,PlayMusic,play music by billy powell,billy powell
5354,GetWeather,what is the weather forecast for israel,israel
5355,GetWeather,what is the weather forecast for sep the 14th 2038 in north dakota,sep the 14th 2038 north dakota
5356,PlayMusic,play me the most popular lillian hardin song on itunes,most popular lillian hardin song itunes
5357,PlayMusic,i want to hear steven harwell from the thirties,steven harwell thirties
5358,GetWeather,what is the forecast in texas,texas
5359,PlayMusic,play 1960 chant music by hermann baumann,1960 chant hermann baumann
5360,GetWeather,what is the sri lanka forecast for snow,sri lanka snow
5361,PlayMusic,play deezer,deezer
5362,PlayMusic,play me a bluegrass song,bluegrass song
5363,GetWeather,tell me the weather forecast for equatorial guinea,equatorial guinea
5364,GetWeather,will it snow on apr eighteenth 2029 in myanmar,snow apr eighteenth 2029 myanmar
5365,PlayMusic,play music from 2007,2007
5366,GetWeather,what is the weather forecast for kinbrae,kinbrae
5367,GetWeather,what s the weather looking like right now in croatia,now croatia
5368,PlayMusic,play mohammed abdu from top 20,mohammed abdu top 20
5369,GetWeather,what will the weather be like in 1 minute in my current position,in 1 minute current position
5370,GetWeather,what s the forecast far from here in turks and caicos islands,far here turks and caicos islands
5371,PlayMusic,play some ray williams music from the nineties on spotify,ray williams nineties spotify
5372,PlayMusic,play fifties music on deezer,fifties deezer
5373,GetWeather,will the weather be temperate 188 days from now in zimbabwe,temperate 188 days from now zimbabwe
5374,PlayMusic,play music from 1958,1958
